video_id,title,publishedAt,channelId,channelTitle,category,trending_date,tags,view_count,likes,dislikes,comment_count,thumbnail_link,comments_disabled,ratings_disabled,description
"5NPe8_gDSr4","SEVENTEEN (세븐틴) 'LOVE, MONEY, FAME (feat. DJ Khaled)' Official MV","2024-10-14T08:58:07Z","UC3IZKseVpdzPSBaWxBxundA","HYBE LABELS","Music","24.15.10","HYBE|HYBE LABELS|하이브|하이브레이블즈","13722043","531385","0","39286","https://i.ytimg.com/vi/5NPe8_gDSr4/default.jpg","False","False","SEVENTEEN (세븐틴) 'LOVE, MONEY, FAME (feat. DJ Khaled)' Official MVCredits:Producer｜HAN SUNGSOOHead of Production｜KIM DAUNCreative Director｜YI HYOJINCreative Production｜JANG DAHYE, PARK SHINYOUNGA&R｜AMANDA CHO, CHO INWOOKVC｜LEE HYEMI, KIM HYODAHMPerformance Directing｜YOON HYELIMIn-house Production｜KIM HYUNJUNG, JEON SUNGHYE, AHN JAEIN, CHO HYUNJEONGHead of Artist PM & Protocol & Operation｜AHN SOLYANGArtist PM & Protocol & Operation｜SHIN DOYUN, KIM HYEJIN, PARK YURI, PARK GEUNBEOM, LEE HYUNJU, JEONG YEONJUN, LEE DONGYOUNG, SONG JINWOO, HAN SEOYEON, PARK BYUNGHYUK, LEE MOONWON, LEE SINHYUN, LEE SEUNGHEE, CHAE SEUNGMO, LEE JEONGYONG, KIM JUHA, LEE GUNHEE, KOH JUNYOUNG, LEE SANGJAE, PARK BOOLHWEE Production｜SL8IGHT VISUAL LABDirector｜725Chief Producer｜Seunghyeon JoProducer｜Soyeon Lee, Seulgi YiAD | Anna Kim, Saeyoung Kim, Jeongeun Kim, Handeul LeeBangkok Director of Photography｜EumKoFocus Puller | Youngwoo Lee2nd｜Eunil Lee, Yuntae KoSeoulDirector of Photography｜Giung Seo (Line of Sight) Focus Puller｜Seungjong Lee2nd｜Hyukjae Yang, Ilho BaeDIT｜Hyunbae Jeon3rd｜Junsung Cha Technocrane | Servicevision koreaHead Operator | Taehyun ChoiCrane Operator | Jisoo WooCrane Tech | Junhwan AnAssist | Woojin ImDrone | GODFINGERHead Operator | Minjae LeeGimbal Operator | Junhwan Cha1st Assistant | Youngjun Park2nd Assistant | Euntae Lee Lighting Director｜Hyunsuk Song1st｜Junghyun Choi, Taehui Lee2nd｜Junhui Min, Jina Bak, Yudeok Jo, Jiyong Sin3rd｜Daehyeong Kim, Gyumin Kim, Doyeon Kim4th | Yujin Nam, Ilho Gong, Yujeong AnArt｜Mu:EArt Director｜Bona Kim, Jinsil ParkAsst. Art Director｜Jawon Kim, Dongheui Kim, Yesol KimArt-team Manager | Ilho HeoArt-team | Habin Cho, Younghun Jin, Eunseob Choi, Hyunwoong Noh, Sunghyun ParkSpecial Effect | Kyoungsoo Park(JUST)SPFX Supervisor | Changsok Kim, Dongho LeeSPFX  Coordinator | Yeongung Choe, Minjun Choi, Heetae KimSPFX  Technician | Chanmin Lee, Gaye Jo, Geonwoo Kim, Geonmin woo, Taeho Yoon2D VFX｜Hyunah Cha2D Cleaning, Beauty | Hyeji Kim2D Cleaning | COMMA3D VFX｜Second FloorVFX Supervisor | Daeyoung ByunVFX Producer | Hyeongdeok Im2D Composite Lead | Ayoung Lee 2D Composite Artist | Youngjun Ko, Heesu Kim, Suhwan Kim, Yewon Ahn3D / FX Artist | Geoyoung Yoo, Seokjoo Jang, Zinzin, Jinseong ParkColorist｜Changbeen Yu (VISION)DI Assistant｜Soyeon Kim, Nayeon Kim, Seowoo KangLocation｜Eunjung Park, Nakjo Kim, Jaehyeon Kim (Zone System) Production Team Leader｜Saewon YuProduction Team｜Salva Seo, Hyeokhyeon Kwon, Sujeong Choi, Jihoon Lim, Youngjin Kim, Kyungtae Kim, Heechan Lee[Thailand Credits]Thai Production | UmoonExecutive Producers｜Julien Casanova, Thomas Menard[US Credits]US Production | DurooExecutive Producer | David Hong#SEVENTEEN #세븐틴#SPILL_THE_FEELS#LOVE_MONEY_FAMEConnect with SEVENTEENOfficial Homepage : http://www.seventeen-17.comOfficial YouTube : https://www.youtube.com/@pledis17Official X (Twitter) : https://twitter.com/pledis_17Official Instagram : http://www.instagram.com/saythename_17Official Facebook : https://www.facebook.com/seventeennewsOfficial TikTok : https://www.tiktok.com/@seventeen17_officialOfficial Weverse : https://www.weverse.io/seventeenⓒ PLEDIS Entertainment. All Rights Reserved"
"Rilh87B_0Ow","新情報盛りだくさん！ プロスピA 9周年記念特番","2024-10-14T13:46:17Z","UCWzEh28vj3mQKpe0fzVTOUw","パワプロ・プロスピ公式チャンネル","Gaming","24.15.10","[none]","942287","11183","0","585","https://i.ytimg.com/vi/Rilh87B_0Ow/default.jpg","False","False","プロスピA 9周年の豪華キャンペーン情報をお届けする特番！10/14(月・祝) 20:15-配信！さらに今回は新大会も実施！〓V.I.P〓さん、CLAYさん、サワさんがリアルタイム対戦でガチンコ対決を繰り広げる！？【番組スケジュール】●第1部〓V.I.P〓さん、CLAYさん、サワさん ガチンコリアルタイム対戦 20:15-●第2部新情報発表特番21:30ごろ-【出演者】■ 〓V.I.P〓さん■ CLAY さん■ サワ さん■ 槇嶋 範彦 さん▼プロスピA 公式Xはこちらhttps://x.com/prospiA_PR▼エナジーがお得に買えるコナミの公式WEBストアhttps://pawaspi-point.konami.net/general/prospi_games_store?utm_source=youtube&utm_medium=social&utm_content=9th_20241014&utm_campaign=web_store_prospiags一般社団法人日本野球機構承認ⓒ2024 SAMURAI JAPAN©世界野球ソフトボール連盟日本プロ野球名球会公認日本プロ野球OBクラブ公認日本プロ野球外国人OB選手会公認プロ野球フランチャイズ球場公認ゲーム内に再現された球場内看板は、原則として2023年度プロ野球公式戦のデータを基に制作しています。 データは、Japan Baseball Data(株)が独自に収集したものであり、公式記録とは異なる場合があります。提供情報の手段を問わず、いかなる目的であれ無断で複製、転送、販売等を行う事を固く禁じますGetty ImagesAll other copyrights or trademarks are the property of their respective owners and are used under license.©Konami Digital Entertainment"
"2w7VTf-uF6Q","【大谷翔平】【ドジャース】ドジャース対メッツ リーグ優勝決定シリーズ  10/15 【野球実況】","2024-10-14T23:55:22Z","UCSDobaWqvIttZUa1xXi4sRQ","ハムショーのスポーツ実況ch","Sports","24.15.10","[none]","1050536","4479","0","25","https://i.ytimg.com/vi/2w7VTf-uF6Q/default.jpg","False","False","大谷翔平　ドジャース　大谷翔平速報　2024年10月15日　ドジャース対メッツ戦を実況生配信でお送りします。サブチャンネルはこちら  @dodgesho Tシャツ・マグカップ・タオル　グッズショップはこちら！https://muuu.com/collections/42847-1031641UUUMのハムショー紹介ページはこちらhttps://uuum.jp/creator/hamushoプレゼントはこちらにお送りください！〒107-6228東京都港区赤坂9-7-1 ミッドタウン・タワー 28階ハムショー　宛※ お送りいただいたプレゼントはスタッフが開封確認をした後にクリエイター本人にお渡しいたします。※ 一度お送りいただいたファンレター・プレゼントは、原則としてお返しできません。※ 必ず【対象クリエイター名】を明記の上、お送り下さい。※ UUUMオフィスへの直接のお持込みはお断りさせていただきます。※ 危険物、飲食物、生もの、生き物、現金、金券（ギフトカード・プリペイドカード含む）などについては、スタッフの判断により、受け取りをお断りさせていただく場合がございます。あらかじめご了承ください。※ 送料不足、着払いなどでお送りいただいた場合は受け取ることができません。※ バレンタインデー、誕生日などの贈り物も、上記の注意点についてご確認をお願いいたします。DIGVOICEアプリDLリンク：https://digvoice.onelink.me/Wq6d/prr0xxh9スポンサー企業一覧野球ユニフォームのファンゴ様https://bit.ly/48W68jfブログ記事を書いていただきました！https://bit.ly/3Ppnhe9奥州いわい様からあげ家奥州いわいHP：https://iwai181.net/奥州いわいネットHP：https://iwai181.shop-pro.jp/マイプロテイン様【TEAMJP】入力で割引！注文はこちら→https://prf.hn/l/PlngzG5ネイチャーカン様Naturecan CBDサイト：https://bit.ly/3ubgUDVNaturecan フィットネスサイト：https://bit.ly/499VkP2クーポンコード【HAMUSHO】で10％オフ!!モデレーター応募フォームはこちら！https://forms.gle/d9tW5ALs18bcNPow6メンバーシップ始めました！スタンプ、コミュニティでの投稿、限定の動画、顔出しでの限定生配信、参加型配信などを予定しています！ご参加お待ちしています！https://www.youtube.com/channel/UCSDobaWqvIttZUa1xXi4sRQ/join基本的にはクレジットカード決済ですが、こちらの動画のやり方をすればクレジットカードなし、グーグルプレイカード(コンビニなどにあります)で携帯の機種問わず登録できます。https://youtu.be/N_Ak18km4WoX(旧Twitter)https://mobile.twitter.com/fighters28123Instagramhttps://www.instagram.com/fighters28123?igsh=MWpjcHlxbHQxZmJ2MQ%3D%3D&utm_source=qrTikTokhttps://www.tiktok.com/@fighters28123?_t=8kG9hcKltn5&_r=1こちらのフォローもお願いします！BGMはきゃすたぁわいるどさんの提供で使わせていただいています！https://youtube.com/c/%E3%81%8D%E3%82%83%E3%81%99%E3%81%9F%E3%81%81%E3%82%8F%E3%81%84%E3%82%8B%E3%81%A9音楽編集ソフトで打ち込んだ曲を使用しています。#大谷翔平  #ドジャース    #大谷翔平速報 　 #大谷翔平ライブ  #大谷 ＃ドジャースライブ  ＃大谷ライブ  ＃メジャー　＃大谷翔平速報今日 ＃ラジオ実況  ＃スポーツ実況  #mlb＃大谷ホームラン #メッツ #千賀"
"PAKZveTVsSs","Snow Man「One」Music Video","2024-10-14T12:00:07Z","UCuFPaemAaMR8R5cHzjy23dQ","Snow Man","Music","24.15.10","Snow Man|スノーマン|岩本 照|Hikaru Iwamoto|深澤 辰哉|Tatsuya Fukazawa|ラウール|Raul|渡辺 翔太|Shota Watanabe|向井 康二|Koji Mukai|阿部 亮平|Ryohei Abe|目黒 蓮|Ren Meguro|宮舘 涼太|Ryota Miyadate|佐久間 大介|Daisuke Sakuma","2658868","101572","0","5453","https://i.ytimg.com/vi/PAKZveTVsSs/default.jpg","False","False","_________________________________________________________「One」Music Video 【4K】Subtitles are available in various languages.TVアニメ『ブルーロック VS. U-20 JAPAN』エンディング主題歌TV ANIMATION “BLUELOCK” 2nd SEASON ED THEME SONG◆Streaming & Download nowhttps://mentrecording.lnk.to/oneDirector : Hidejin Kato　_________________________________________________________#本気はまぶしい◆Instagram　https://www.instagram.com/snowman.official.9/◆TikTok　 https://www.tiktok.com/@snowman_mentrecording_s◆X　 https://x.com/SN__20200122◆Weibo　 https://www.weibo.com/SnowManofficial◆STARTO ENTERTAINMENT Official Sitehttps://starto.jp/◆Snow Man Official Websitehttps://mentrecording.jp/snowman/▼Snow Man 4th Album「RAYS」2024.10.30 on sale.https://snowman.lnk.to/4thalbum_alltitles#SnowMan #すのちゅーぶ #RAYS #SnowMan_One #One #岩本照 #深澤辰哉 #ラウール #渡辺翔太 #向井康二 #阿部亮平 #目黒蓮 #宮舘涼太 #佐久間大介 #HikaruIwamoto #TatsuyaFukazawa #Raul #ShotaWatanabe #KojiMukai #RyoheiAbe #RenMeguro #RyotaMiyadate #DaisukeSakuma #岩本照 #深澤辰哉 #ラウール #渡辺翔太 #向井康二 #阿部亮平 #目黒蓮 #宮舘涼太 #佐久間大介"
"Xptp59SzcL0","INI | 'WMDA(Where My Drums At)' Official MV","2024-10-14T12:00:40Z","UCc-itdQHxLvUlPrDxIiSJrA","INI","Music","24.15.10","INI|アイエヌアイ|PRODUCE101|아이앤아이|池﨑理人|尾崎匠海|木村柾哉|後藤威尊|佐野雄大|許 豊凡|髙塚大夢|田島将吾|西洸人|藤牧京介|松田迅","1157571","32620","0","9884","https://i.ytimg.com/vi/Xptp59SzcL0/default.jpg","False","False","INI 7TH SINGLE THE VIEW2024.10.30 RELEASEhttps://cf.ini-official.com/feature/theview〈INI OFFICIAL SNS〉▶︎ https://ini-official.com▶︎ https://twitter.com/official__INI▶︎ https://www.instagram.com/official__ini/▶︎ https://www.tiktok.com/@official__ini▶︎ https://weibo.com/7624202468/profile?topnav=1&wvr=6 #INI #INI_THE_VIEW #INI_Where_My_Drums_At#INI_WMDA"
"1h8ICsOtDC4","【しばゆー復活記念】10年に1度の奇跡！一泊二日寝てもいい「普通の旅」！！！","2024-10-13T12:00:02Z","UCutJqz56653xV2wwSvut_hQ","東海オンエア","Comedy","24.15.10","[none]","3160320","119666","0","6345","https://i.ytimg.com/vi/1h8ICsOtDC4/default.jpg","False","False","どうも、東海オンエアです。ぜひチャンネル登録お願いします！サブチャンネル【東海オンエアの控え室】もぜひチャンネル登録してね！！！https://www.youtube.com/channel/UCynIYcsBwTrwBIecconPN2Aグッズ購入はこちらから！https://tokaionair.jp/東海オンエアLINEスタンプはこちらから！https://uuum.jp/posts/614231東海オンエアLINE公式アカウント　友達登録はこちらから！https://lin.ee/c19Zdjmお仕事の依頼はこちらからhttps://www.uuum.co.jp/inquiry_promotionファンレターはこちらへ〒107-6228東京都港区赤坂9-7-1ミッドタウン・タワー 28階UUUM株式会社 東海オンエア宛【東海オンエアの個人アカウント】てつや個人チャンネル：https://www.youtube.com/channel/UC1xd0cAOryAMTTG34joEgdgX：https://twitter.com/TO_TETSUYAInstagram：https://www.instagram.com/to_tetsuya/しばゆーX：https://twitter.com/TOKAI_ONAIRInstagram：https://www.instagram.com/to___shibayu/りょう個人チャンネル：https://www.youtube.com/channel/UCigMkMDZjvLhXAQ67wKQIbAX：https://twitter.com/TO_RYOOInstagram：https://www.instagram.com/to_ryoo/としみつ個人チャンネル：https://www.youtube.com/channel/UCDFxQgB9Dc_MzxiEKjozWwgX：https://twitter.com/TO_TOSHIMITSUInstagram：https://www.instagram.com/toshimitsu_tokaionair/ゆめまる個人チャンネル：https://www.youtube.com/channel/UCevQsKO8q1XQcEA1BoBO2gAX：https://twitter.com/TO_yumemarucasInstagram：https://www.instagram.com/yumemaru_original/虫眼鏡個人チャンネル：https://www.youtube.com/channel/UCbSIiNFWbJCW8ERBbkNMfwQX：https://twitter.com/TO_ZAWAKUNInstagram：https://www.instagram.com/to_mushimegane/"
"_T0-8SL6iRA","やらかしました。動画が出せなくなりました。","2024-10-14T10:35:02Z","UCgMPP6RRjktV7krOfyUewqw","はじめしゃちょー（hajime）","Entertainment","24.15.10","hajime|はじめしゃちょー|funny|crazy|japanese|はじめ","1096658","30932","0","2620","https://i.ytimg.com/vi/_T0-8SL6iRA/default.jpg","False","False","チャンネル登録よろしくおねがいします !My name is Hajime! ファンサイトはこちら。▽「はじメーノ」：https://fanicon.net/fancommunities/4246はじめしゃちょーの畑：https://www.youtube.com/channel/UClKeJXipXwX7_ZGxOBnMQywはじめしゃちょー2（ゲーム実況など）：https://www.youtube.com/user/hajimexgameX(Twitter): https://twitter.com/hajimesyachoInstagram: https://instagram.com/hajimesyachodesu?r=nametagTikTok: https://vt.tiktok.com/ZSJ18mmm5/Clubhouse:@hajimen裏垢:https://twitter.com/duelhajimeLINEスタンプはこちら！はじめしゃちょーhttps://store.line.me/stickershop/product/1072663/jaはじめしゃちょー2https://store.line.me/stickershop/product/1169745/ja・動画内における素材提供 ＿人人人人＿＞　PIXTA　＜￣Y^Y^Y￣------------------------------------------------------------------------------ 楽曲提供：Production Music by http://www.epidemicsound.com                     フリーBGM DOVA-SYNDROME by http://dova-s.jp/　　　　　BGMer:https://bgmer.net/------------------------------------------------------------------------------"
"svbfMJJk_90","もういいよ / こっちのけんと MV","2024-10-14T13:00:06Z","UC1laSZHo_6VBXU9FmfGNwFA","こっちのけんと","Entertainment","24.15.10","菅田将暉|菅田三兄弟|兄弟|こっちのけんと|菅生健人|菅生新樹|マダムタッソー|菅田将暉弟|菅田将暉兄弟|菅生家|マサキチ|オールナイトニッポン|YouTuber|小松菜奈|まちがいさがし|1人アカペラ|アカペラ|歌ってみた|オリジナルソング|新曲|虹プロ|虹プロジェクト|サントラ|ドラス|キスだけで|声だけ|声だけで|神回|マリオ|マリオメドレー|マリオアカペラ|ひとりアカペラ|菅田将暉の弟|マリオサンシャイン|64|任天堂|Nintendo|Nintendo Switch|スイッチ|オデッセイ|マリオオデッセイ|スーパーマリオ|SuperMario|mario|acapella|SuperMarioMedley|supermario|BTS|ダイナマイト|butter|Butter|Acapella|バター|Billboard|ポケモン|神曲|ピカチュウ|ニャース|ソード|シールド|死ぬな！|死ぬな|死にたい|死について|おかのやともか|るーか|早希|しもれん|はいよろこんで|どんぐりゲーム|菅生あらき|菅生|大将|菅生大将|音楽|MV|韓国|もういいよ|てるめる|テルメル","567499","30256","0","2228","https://i.ytimg.com/vi/svbfMJJk_90/default.jpg","False","False","この曲は軽蔑や飽和、解放の意味がある「もういいよ」という言葉を主軸に最近の考えを込めました。三種のチーズ的な感じです。生きてると誰しも『人前スイッチ』みたいな設定がきっとあって、それは一種の進化ではあるけど進歩ではないと言いたいなと思い制作いたしました。「私の前では素でいてね」なんて素でいれない人にしか言われたことないですし、「ひらけごま」って無理やり心の扉を開けさせようとしてくる感じが苦手だなと考えてしまいます。こっちの心を開けたいんだったら「私の影の部分までをあなたの目で照らしてよく見てみてほしい」と思いました。やいやいやいやい言いやすい世の中だからこそ、とりあえず許されてる間は世の中を敵にして言っちゃえばいいのではないかと思います。怒られたらやめましょうね。数年後に「こんなこと言ってた時代もあったな」と歴史になればこっちのもんですから。「こう思う人がいるかもしれない」を「こう思う人がいた」に変えるために。🍃🍃🍃🍃🍃🍃🍃🍃作詞：こっちのけんと作曲：こっちのけんと&GRP編曲：GRP(@GRP_beatz)Mixing Engineer：安宅秀紀(@nman_atk)Recording Engineer：古澤みどりMV ：マザえもんTwitter(@mazaemon2005)YouTube(http://youtube.com/@mazawo_ch)弘田マサユキTwitter(@hiromasa_ink)Copyrights 2024© blowout Inc. All Rights Reserved▼全部フォローお願いします。頑張って面白いこと言います。→https://lit.link/SuppokoPeppoko▼公式グッズはこちらhttps://suzuri.jp/SuppokoPeppoko▼人気の動画集https://www.youtube.com/playlist?list=PLuzm7ZJ7XWnAyXzSQeU1MtBMOMMSQ9DGH▼おすすめ動画https://www.youtube.com/watch?v=t5Ah4y28Rcc&t=11s"
"GORsp0gc2Nc","【Ado】初夏 (Shoka)","2024-10-14T11:00:06Z","UCln9P4Qm3-EAY4aiEPmRwEA","Ado","Music","24.15.10","[none]","895254","93513","0","3245","https://i.ytimg.com/vi/GORsp0gc2Nc/default.jpg","False","False","大嫌いな夏と、大嫌いな自分の歌です。Download & Streaminghttps://ado.lnk.to/shokaIDVocal, Lyrics & Music : Adohttps://twitter.com/ado1024imokenpBass : 高間有一様Drums : 比田井修様Keyboards : 奥野真哉様Arrangement, Guitars & All Other Instruments : 三井律郎様https://twitter.com/theyouthguitarRecording & Mixing Engineer : 岡村弦様https://twitter.com/GENDAMIllust : Tru様https://twitter.com/true_root_twMovie : mino様--------------------------------- URL ・Twitter：https://twitter.com/ado1024imokenp ・YouTube：https://www.youtube.com/c/Ado1024・TikTok：https://www.tiktok.com/@ado1024osenbei? ・Universal Music Artist Page：https://www.universal-music.co.jp/ado/ ・Profile：https://cloud9pro.co.jp/artist/profile/ado/---------------------------------#Ado #初夏 #Shoka"
"K22dI3vSNMc","【起死回生の一撃】万波中正『大航海は終わらないッ!!! エスコン総立ちの超特大同点ソロ弾！』【パないはたらき】","2024-10-13T09:00:15Z","UC0v-pxTo1XamIDE-f__Ad0Q","(パーソル パ・リーグTV公式)PacificLeagueTV","Sports","24.15.10","パーソルパリーグTV|パリーグTV|パシフィックリーグ|Pacificleague|プロ野球","1205575","25878","0","2410","https://i.ytimg.com/vi/K22dI3vSNMc/default.jpg","False","False","ファイターズは追い込まれた9回裏に土俵際で粘る。1死から暗いムードに包まれた中で万波中正がレフトスタンドへ豪快特大同点ホームラン!! 起死回生の一発で嫌な流れを断ち、エスコンフィールドは大歓声に包まれる!!ぜひ、皆さまのご投票で、パないはたらきの選手を決めましょう!!(ご投票は下記URLよりお願いいたします!!)※ファン投票企画「みんなで選ぶ“パない”はたらき投票キャンペーン」特設ページhttps://www.persol-group.co.jp/special/pacificleague/2024/campaign24/■パテレグッズ好評発売中!! 各商品ご購入はこちら!!https://ptv-shop.pacificleague.com/他にもパ・リーグの注目動画がたくさん！全てを見逃さないために【チャンネル登録】を！▷https://www.youtube.com/channel/UC0v-pxTo1XamIDE-f__Ad0Q＜パ・リーグ主催全試合を生中継！パーソル パ・リーグTVはこちら！＞https://pacificleague.com/ptv✓パ・リーグ6球団公式情報をお届け：https://pacificleague.com/news✓パ・リーグの過去映像を見るなら：https://www.youtube.com/channel/UCrjlKkKTAyNn6gekRM3p0Aw/SNSも毎日更新中！▶X：https://twitter.com/PacificleagueTV▶Instagram：https://www.instagram.com/pacificleaguetv/▶Facebook：https://www.facebook.com/pacificleaguetv▶LINE：https://lin.ee/2hB4obT#鳥肌 #大興奮 #ホームラン #ミラクル #万波中正 #パないはたらき #北海道日本ハムファイターズ #パーソルパリーグTV #パシフィックリーグ"
"yMDE_fmaM5o","がーどまんとの件について","2024-10-13T11:25:40Z","UCj6_0tBpVpmyYSGu6f-uKqw","テオくんホーム","Entertainment","24.15.10","テオくん","537067","5256","0","6661","https://i.ytimg.com/vi/yMDE_fmaM5o/default.jpg","False","False","こっちのチャンネルもどうかよろしくお願いします↓↓↓↓↓↓↓↓↓↓↓↓↓↓↓↓↓↓↓↓↓↓↓ておちゃんぽんちゃんhttps://www.youtube.com/channel/UCYNsWA_e9WeWizoazha0N6AED曲フル動画　GORI 『リボン』 MVhttps://www.youtube.com/watch?v=mQDLD570zusテオくんホーム【YouTube】https://www.youtube.com/channel/UCj6_0tBpVpmyYSGu6f-uKqw【Twitter】https://twitter.com/teokun711スカイピース【YouTube】https://www.youtube.com/channel/UC8_wmm5DX9mb4jrLiw8ZYzw【Twitter】https://twitter.com/skypeace_teojin平和島【YouTube】https://www.youtube.com/channel/UCn_cpHcrXjG_XnH9N3fO6qA"
"T7lmIH3d04U","Team Cam vol.02｜鎌田大地、小川航基の2得点でジッダで初勝利 サウジアラビア戦の舞台裏｜SAMURAI BLUE ｜AFC Asian Qualifiers - Road to 26","2024-10-14T10:28:18Z","UCgIeUSV91-FfmCayG4lSBcw","JFATV","Sports","24.15.10","[none]","340109","5146","0","523","https://i.ytimg.com/vi/T7lmIH3d04U/default.jpg","False","False","#SAMURAIBLUE（日本代表）は#ワールドカップ 26 アジア最終予選（3次予選）の第3戦でサウジアラビア代表と対戦し、#鎌田大地 選手、#小川航基 選手がゴールを決め、鬼門だったジッダで0-2で初勝利しました。第4戦は、10/15(火)19:35に埼玉スタジアム2002でオーストラリア代表と対戦します。▼公開予定日Team Cam vol.3： 10月17日(木)予定※公開日は前後する可能性があります。⚔️NEXT MATCH⚔️🗓️10.15(火)⌚️19:35(🇯🇵)🆚オーストラリア代表🇦🇺🏟埼玉スタジアム2002(埼玉)📺#テレビ朝日 系列📱DAZN00:00 オープニング00:34 トレーニング03:19 #藤田譲瑠チマ 選手03:55 トレーニング後の一コマ #上田綺世 #久保建英 #南野拓実 #中村敬斗05:25 前日公式会見05:57 前日練習前の様子07:06 #森保一 監督07:53 前日練習08:41 #前田遼一 コーチ誕生日祝い10:00 試合当日ミーティング10:42 チームがスタジアムに到着11:47 試合前ウォーミングアップ12:27 試合前円陣13:05 前半13:35 ハーフタイム14:34 後半～試合後の様子15:25 #森保一 監督16:21 #谷口彰悟 選手16:56 #遠藤航 選手17:22 #小川航基 選手17:33 #鎌田大地 選手17:57 サポーターへ挨拶18:38 日本へ移動▼詳細はこちらhttp://www.jfa.jp/samuraiblue/▼チームに密着した #TeamCam 過去の動画はこちらからhttps://www.youtube.com/playlist?list=PLddnt05D-xvQMMcJ_QR8sm--yWzluHaHi▼公式WEBサイト「JFA.jp」https://www.jfa.jp/samuraiblue/▼公式X（旧Twitter）https://twitter.com/jfa_samuraiblue▼公式Instagramhttps://www.instagram.com/japanfootballassociation/▼公式TikTokhttps://www.tiktok.com/@jfa_samuraiblue▼公式Facebookhttps://www.facebook.com/samuraiblue/"
