video_id,title,publishedAt,channelId,channelTitle,category,trending_date,tags,view_count,likes,dislikes,comment_count,thumbnail_link,comments_disabled,ratings_disabled,description
"d0jg9hNHqn8","『アオのハコ』ノンクレジットオープニング│Official髭男dism「Same Blue」│ Blue Box Opening","2024-10-03T15:30:13Z","UCkVvAm5jb62IMIJQj4wPVGA","TMSアニメ公式チャンネル【アニメ制作60周年】","Film & Animation","24.15.10","トムスエンタテインメント|TMS|アニメ","1654969","43532","0","2042","https://i.ytimg.com/vi/d0jg9hNHqn8/default.jpg","False","False","TVアニメ『アオのハコ』 10月3日より毎週木曜よる11時56分～TBS系28局全国同時放送開始 Netflixにて10月4日（金）より先行配信スタート Official髭男dismによる『アオのハコ』オープニングテーマ「Same Blue」が彩るノンクレジットオープニング映像を公開！ ◇イントロダクション◇ 青さが胸を衝く、青春部活ラブストーリー 「週刊少年ジャンプ」（集英社）にて好評連載中の三浦糀による大人気マンガ『アオのハコ』。 等身大のキャラクター達がそれぞれの想いを胸に部活に打ち込むひたむきな姿と、“誰かを好きになった時”の心の機微を繊細に描いた本作は、2021年4月の連載開始から多くの読者を魅了している。 ◆STORY◆ 毎朝一番に会いたい人がいる―― 中高一貫のスポーツ強豪校・栄明高校に入学する、男子バドミントン部の一年生・猪股大喜。 大喜は毎朝、朝練で顔を合わせる一つ上の先輩、鹿野千夏に恋をする。 千夏は女子バスケットボール部のエースで、校内外問わず人気の高嶺の花。 部活に恋に勉強に、大喜にとって忙しい高校生活がはじまる、そんなある日――  ◇放送情報◇ 10月3日より毎週木曜よる11時56分～TBS系28局全国同時放送開始 ◆配信情報◆ Netflixにて10月4日（金）より先行配信スタート　 ※1話のみ、TV放送終了後に配信（第1話＆第2話） 他各配信サイトはTV放送終了後に順次配信  ◇スタッフ・キャスト◇ 原作：三浦糀（集英社「週刊少年ジャンプ」連載） 監督：矢野雄一郎  シリーズ構成・脚本：柿原優子 キャラクターデザイン・総作画監督：谷野美穂 色彩設計：今野成美  美術監督：藤井王之王  撮影監督：川下裕樹  編集：笠原義宏  音響監督：明田川仁 音楽：大間々昂 クリエイティブアドバイザー：モギ シンゴ  企画プロデュース：UNLIMITED PRODUCE by TMS  アニメーション制作：テレコム・アニメーションフィルム 猪股大喜：千葉翔也 鹿野千夏：上田麗奈 蝶野雛：鬼頭明里 笠原匡：小林千晃 針生健吾：内田雄馬 ◆主題歌◆ ・オープニングテーマ：Official髭男dism「Same Blue」(IRORI Records / PONY CANYON) ・エンディングテーマ：Eve「ティーンエイジブルー」（TOY'S FACTORY） HP：https://aonohako-anime.com/ X公式(旧Twitter）：https://twitter.com/aonohako_PR  アニメ公式TikTok：https://www.tiktok.com/@aonohako_pr  ＃アニハコ ＃アオのハコ ©三浦糀／集英社・「アオのハコ」製作委員会"
"JXLuvHQPg_Y","2泊3日絶対に座ってはいけない旅行が過去1地獄の旅行でした。","2024-10-04T11:01:11Z","UCP-32CzsbLiiIb2LbYk8mZA","Lazy Lie Crazy【レイクレ】","Comedy","24.15.10","レイクレ|ともやん|急上昇|コムドット|どば師匠|てっちゃん|たかし|ぺろ愛男爵|東海オンエア|フィッシャーズ|神回|はじめしゃちょー|エスポワール|平成フラミンゴ|Youtuber|新世代|TikTok|お笑い|れいくれ|面白い","1178698","19763","0","825","https://i.ytimg.com/vi/JXLuvHQPg_Y/default.jpg","False","False","#座ったら即帰宅#即帰宅#過酷#旅行#バラエティ#長野#地獄#天国48時間限定でレイクレ×シャインマスカットはこちらから購入できます！▼購入はこちらから！https://item.rakuten.co.jp/gurutan/n01shi5090/発売日：本日2024年10月7日（月）18:00~10月9日（水）18:00まで！価格：5,090円(税込)特典：レイクレトレーディングカードがランダムで1枚入り（全6種類）■2泊3日座ったら即帰宅の旅行1話 https://youtu.be/JXLuvHQPg_Y2話 https://youtu.be/25ZzPipwRgg3話 https://youtu.be/KLWuF1pvwSU4話 https://youtu.be/DanuWvOFiaw＝＝＝サブチャンネルも登録よろしくな！！■深夜のレイクレhttps://www.youtube.com/@Lazy_Lie_Crazy_Sub■レイクレGAMEShttps://www.youtube.com/@Lazy_Lie_Crazy_Games■お問い合わせ/お仕事の依頼はこちらから【info@sai-oh.jp】■個人チャンネルはこちら！どば師匠→https://www.youtube.com/@レイクレどば師匠-o1fてっちゃん→https://www.youtube.com/@jcinema5068ともやん→https://www.youtube.com/@tomoyan6たかぺろFM107→https://www.youtube.com/@user-ku5kh9qt3z■各種SNSはこちら！【Instagram】Lazy Lie Crazy【レイクレ】→https://www.instagram.com/lie_lazy090/どば師匠→ http://instagram.com/lazy_doba/たかし→ https://www.instagram.com/t_kashi_dayoてっちゃん→ https://www.instagram.com/tttigrisx/ともやん→ http://instagram.com/tmyndayo/ぺろ愛男爵→ https://instagram.com/peroai/【X (旧Twitter)】Lazy Lie Crazy【レイクレ】→https://twitter.com/lie_lazyどば師匠→ https://twitter.com/lazy_dobaたかし→  https://twitter.com/t_kashi_dayoともやん→  https://twitter.com/tmyndayoてっちゃん→  https://twitter.com/llc_tecchanぺろ愛男爵→  https://twitter.com/peroaidanshaku1【TikTok】Lazy Lie Crazy【レイクレ】→https://www.tiktok.com/@lie_lazyどば師匠→ https://www.tiktok.com/@lazy_dobaたかし→https://www.tiktok.com/@lazy_takashiてっちゃん→ https://www.tiktok.com/@llc.tecchanともやん→ https://www.tiktok.com/@tmyndayoぺろ愛男爵→ https://www.tiktok.com/@peroai■動画エンディングhttps://youtu.be/-nuCJRN1YDo＝＝＝＝レイクレ＆ともやん個人チャンネル＆深夜のレイクレ切り抜きプロジェクトへの参加をご希望の方は下記フォームからご応募お願いします！その後、事務を代行するAnyMind Japan株式会社よりご連絡を差し上げますのでその説明に従ってください。（返信は平日の日中のみ、土日祝祭日はお休みとなります。）切り抜きプロジェクトの応募フォームはこちら↓https://forms.gle/UT3QzSSb3JQG5xvR7※切り抜きプロジェクトに関するお問合せは応募フォームに記載のメールアドレス（lazy~.com）にお願いします。＝＝＝＝"
"NCV0JaEL4_g","【家庭訪問】初の試み！エミリンちゃんのご自宅にお邪魔してメイクレッスン🤍 小田切ヒロ、暴れまくりました🤍🤍","2024-10-05T10:00:21Z","UC8oF7jmQsKbMVrCv5LrP32w","HIRO BEAUTY CHANNEL","Howto & Style","24.15.10","小田切ヒロ|メイク|コスメ","417704","12190","0","605","https://i.ytimg.com/vi/NCV0JaEL4_g/default.jpg","False","False","みなさん、こんにちは。ヘア＆メイクアップアーティストの小田切ヒロです。今回は、「エミリンちゃん家に家庭訪問」しちゃったのよ🤍初めての企画！人のお家にお邪魔虫先生しまして、メイクレッスンしちゃったわ🤍今回はエミリンちゃん🤍 人のお家に伺うの久々だったからすごく新鮮だったわ🤍エミリンちゃんのコスメ収納を見させてもらって、使っていない・眠っているコスメを取り出して、メイクしてみたの〜🤍それだけじゃ足りないからエミリンちゃんの一張羅もお借りして、記念撮影もしたわ🤍す〜ごい楽しかったわ🤍エミリンちゃんありがとう🤍お家訪問企画またやりたいので、誰か訪問していいYouTuberさんご連絡よろしくお願いします🤍エミリン : @emirin ▼エミリンちゃんのチャンネルではアットコスメでお買い物企画よ🤍https://youtu.be/w1hq2kbIQOk?si=JjSspifuXOH1mswu******************▼エミリンちゃん家に家庭訪問♡0:00 ここはどこかしら～♡0:22 着いたわよ♡1:11 エミリンちゃんのお宅に来たわ～♡3:40 エミリンちゃんの眠りコスメをチェックよ♡4:01 Too Faced ヤミー ガミー メイクアップ コレクション (2022年クリスマスコフレ) 4:11 Benefit ブラッシュ ボス ブラッシュ ブロンズ & ハイライトパレット4:30 NARS オーガズムフォープレイ ブラッシュクワッド4:38 JILL STUART ミッドナイトチェリー コレクション (2022年クリスマスコフレ) 5:03 VALENTINO BEAUTY ロッソ ヴァレンティノ マット5:22 VALENTINO BEAUTY Vライター ローズ5:52 CANMAKE ジュエリーシャドウベール 066:09 Elégance エレガンス コフレ タンタシオン (2022年クリスマスコフレ) 6:20 DIOR マスカラ ディオールショウ アイコニック オーバーカール 374 ダーク グリーン (数量限定色)6:41 JILL STUART ユニコーンユートピア コレクション (2023年クリスマスコフレ)7:11 SOYOブラシの使い方を教えてあげる♡8:04 Makeup Startよ♡8:06 PAUL ＆ JOE モイスチュアライジング　プライマー 00 4,070円(税込)8:19 VALENTINO BEAUTY Vライター ローズ 7,700円(税込)11:09 shu uemura アンリミテッド ケア ツヤ セラム ファンデーション 472 7,480円(税込)11:15 shu uemura ツヤ 55 ファンデーション ブラシ 6,820円(税込)15:47 FIVEISM × THREE コンシール バー S 06 4,620円(税込)18:26 clé de peau Beauté プードルコンパクトエサンシエルn  12,100円(税込)18:35 NARS ライトリフレクティングセッティングパウダー プレスト N 5894 CRYSTAL 5,830円(税込)21:12 Too Faced ヤミー ガミー メイクアップ コレクション (2022年クリスマスコフレ) 23:57 M・A・C グロー プレイ クッショニー ブラッシュ トータリー シンクト 4,950円(税込)25:57 MAYBELLINE NEW YORK ハイパーシャープ ライナー R BK-1 漆黒ブラック 1,419円(税込)26:37 Wonjungyo ウォンジョンヨ Ｗ デイリームードアップパレット 01 ソフトモーブピンク 2,420円(税込)26:56 Fujiko マジカルアイブロウカラー 02 ブラウン 1,408円(税込)27:08 FIVEISM × THREE コンシール バー S 06 4,620円(税込)27:23 shu uemura キヌケアヌード PK 347 ピンクマシュマロ  4,840円(税込)28:44 お着換えしたわ～どうかしら～♡29:02 エミリンちゃんのメイクも似合ってて素敵よ♡29:50 ED******************▼VLOGチャンネル : 小田切ヒロの「そうよ〜」な日常https://www.youtube.com/channel/UCiF2j4FUWiWzBo_rhpfFVOA▼CONTACThttps://forms.gle/k7pnr2PUfZ7obir66▼Instagramhttps://www.instagram.com/hiro.odagiri/▼TikTokhttps://www.tiktok.com/@hirobeautychannel▼LINEスタンプはこちらから🤍🤍https://line.me/S/sticker/28428271******************#小田切ヒロ #エミリン #メイク #メイクレッスン #コスメ収納 #コスメ #ファッション #ルームツアー #家庭訪問 #自宅 #おすすめ"
"TzelN5LFjm4","【山田五郎から皆さまへのご報告】","2024-10-04T10:00:36Z","UCq1r8Nq3nwI9VhvyiwcpF2w","山田五郎 オトナの教養講座","Education","24.15.10","[none]","1107819","40975","0","2994","https://i.ytimg.com/vi/TzelN5LFjm4/default.jpg","False","False","皆様、引き続きどうぞよろしくお願いいたします。【※切り抜き禁止回です※】チャンネル登録・👍ボタン・コメントお願いします✊【お知らせ】①当チャネルで配信した印象派を中心に対話形式でまとめた書籍が発売されました📗　製作に２年もかけた、５００頁を超える大作です🙌　以下サイトからも購入いただけます！　https://amzn.asia/d/07XTORLG②当チャンネルのYouTubeが書籍化いたしました📕　今までUPされた動画を時代順に掲載しています！　なんと年表・人物相関図・動画連動QRコードあり😊　以下サイトからも購入いただけます！２０２１年度版https://www.amazon.co.jp/dp/4299032543なんと🎉２０２２年度版も新登場💕https://www.amazon.co.jp/dp/4299047400是非、ご購入下さい🙏③五郎さんの深イイ🕶美術本はこちら📚闇の西洋絵画史（黒の闇・白の闇　全１０巻）以下特設サイトからご購入頂けます！📍https://www.sogensha.co.jp/special/yaminoseiyokaigashi/④五郎さんの新しい本が発売されました📕✨  　美術と同じくらい詳しい（機械式時計）の本です🕰  ４００ページの大作です！！！📍https://www.amazon.co.jp/dp/4065233682　📍https://books.rakuten.co.jp/rb/16792569/?l-id=search-c-item-text-15⑤２０２４年４月２３日（火）～　東京（青山）で１年間の美術講座開催。『知識ゼロからの西洋絵画入門』（近代編）『ロマン主義』から『ダダ・シュルレアリスム』まで各、主義を８回に分けて講義。【教室受講】https://www.nhk-cul.co.jp/programs/program_1272015.html【オンライン受講】https://www.nhk-cul.co.jp/programs/program_1272016.html⑥２０２４年１１月１日（金）ＮＨＫ文化センター（青山）でスペシャル講座開催。『みうらじゅん・山田五郎　コロナ画を語る』＜対面受講＞https://www.nhk-cul.co.jp/programs/program_1302789.html＜オンライン受講＞https://www.nhk-cul.co.jp/programs/program_1302768.html✏️公式X（旧：Twitter）はこちら📍https://x.com/yamadagoroCH◎YouTubeへのお仕事・コラボ依頼はXのDMにお願い致します！🎈出演🎈　　　山田五郎🎨企画・編集・イラスト🎨　　　東阪企画🖼画像引用🖼　　　　ウィキメディア・コモンズ#山田五郎　#教養　#教育　#美術　#歴史　#美術史【※切り抜き禁止回です※】"
"s8SSPUQvUzI","TVアニメ「ダンダダン」エンディング映像｜ずっと真夜中でいいのに。「TAIDADA」","2024-10-03T16:01:00Z","UC8yS5dCzbiPGf1HnAwwcnhQ","MBSアニメ&ドラマ","Entertainment","24.15.10","[none]","1090137","24346","0","721","https://i.ytimg.com/vi/s8SSPUQvUzI/default.jpg","False","False","集英社「少年ジャンプ＋」にて連載中の『ダンダダン』（毎週火曜日更新）。TVアニメ24年10月よりMBS/TBS系28局「スーパーアニメイズムTURBO」枠にて全国同時放送中！毎週木曜日25:00～順次配信★公式HP：https://anime-dandadan.com/★公式X：https://x.com/anime_dandadan★ON AIR2024年10月3日から毎週木曜深夜0:26～MBS/TBS系28局「スーパーアニメイズムTURBO」枠にて全国同時放送各配信サイトにて毎週木曜日深夜1:00～順次配信★Introduction霊媒師の家系に生まれた女子高生・モモ＜綾瀬桃＞と、同級生でオカルトマニアのオカルン＜高倉健＞。モモがクラスのいじめっ子からオカルンを助けたことをきっかけに話すようになった2人だったが、「幽霊は信じているが宇宙人否定派」のモモと、「宇宙人は信じているが幽霊否定派」のオカルンで口論に。互いに否定する宇宙人と幽霊を信じさせるため、モモはUFOスポットの病院廃墟へ、オカルンは心霊スポットのトンネルへ。そこで2人は、理解を超越した圧倒的怪奇に出会う。窮地の中で秘めた力を覚醒させるモモと、呪いの力を手にしたオカルンが、迫りくる怪奇に挑む！運命の恋も始まる！？オカルティックバトル＆青春物語、開幕！★STAFF原作：龍 幸伸（集英社「少年ジャンプ＋」連載）監督：山代風我シリーズ構成・脚本：瀬古浩司音楽：牛尾憲輔キャラクターデザイン：恩田尚之宇宙人・妖怪デザイン：亀田祥倫色彩設計：橋本 賢、近藤牧穂美術監督：東 潤一撮影監督：出水田和人編集：廣瀬清志音響監督：木村絵理子アニメーション制作：サイエンスSARU★MUSICオープニングテーマ：Creepy Nuts「オトノケ」https://smar.lnk.to/ozwt6YWEエンディングテーマ：ずっと真夜中でいいのに。「TAIDADA」https://lnk.to/ZTMY_TAIDADA★CASTモモ＜綾瀬 桃＞：若山詩音オカルン＜高倉 健＞：花江夏樹星子：水樹奈々アイラ＜白鳥愛羅＞：佐倉綾音ジジ＜円城寺 仁＞：石川界人ターボババア：田中真弓セルポ星人：中井和哉©龍幸伸／集英社・ダンダダン製作委員会#ダンダダン #若山詩音 #花江夏樹 #水樹奈々 #佐倉綾音 #石川界人 #田中真弓 #中井和哉  #ジャンプ+"
"U8T_XGA9QmY","【太田上田＃４５９②】えなりさんは”上田さんの優しさ”を伝えたい。","2024-10-04T08:00:19Z","UC0M8YI6T69ZgGxWERk681tQ","太田上田【公式】","Entertainment","24.15.10","太田上田|爆笑問題|太田光|くりぃむしちゅー|上田晋也|中京テレビ|大田上田|えなりかずき|EK|上田噺|上田漫談|otaueda","365546","6431","0","659","https://i.ytimg.com/vi/U8T_XGA9QmY/default.jpg","False","False","◎本編まるごと＆未公開シーンはHuluで配信中！https://www.hulu.jp/ota-ueda/?cmp=10301&waad=tRL48IoG&gclid=EAIaIQobChMI3-Twqp326AIVEz5gCh3HrwbmEAAYASAAEgKFZvD_BwE◎ナゴヤ発！TV配信サービス「Locipo（ロキポ）」でも１週間見逃し配信中！https://locipo.jp/playlist/5d291f4d-18b1-45f8-9503-f8b5c2d4fd1b■番組公式HP　https://www.ctv.co.jp/otaueda/■X　https://twitter.com/otaueda#太田上田 #太田光 #上田晋也 #爆笑問題 #くりぃむしちゅー #えなりかずき #EK #上田噺 #上田漫談 #otaueda"
"2D28MAmapxw","序盤虫というポケモン","2024-10-04T11:15:00Z","UCN23GrkNinNMul8a-GcFxWg","机上論者かねこ","Gaming","24.15.10","ポケモン|解説|対戦|ポケモンSV|スカーレット|バイオレット","302123","4068","0","352","https://i.ytimg.com/vi/2D28MAmapxw/default.jpg","False","False","序盤虫についてです序盤ノーマル：https://youtu.be/zNbKUOkIIkA↓チャンネル登録はこちら↓https://www.youtube.com/channel/UCN23GrkNinNMul8a-GcFxWg?sub_confirmation=1【教室の奴】https://youtube.com/playlist?list=PLqWJGDzD9emyKZ8U3ck_M9pYS47MBBRTm【単話完結】https://youtube.com/playlist?list=PLqWJGDzD9emx2MtIKozYQmqp3DXvhb737【ダイパリメイクCMパロディ】廃人しかいないBDSPのCM：https://youtu.be/PNGy12dnQYkBDSPのCMがやっぱりガブリアス：https://youtu.be/utz-Um7gK0Mバトレボをオンラインで遊ぶ方法https://youtu.be/HRAyb4b4kTkバトレボランダム再生リスト（旧）https://youtube.com/playlist?list=PLqWJGDzD9emxSlP3VbEWIGW5x1Evh9HZ3バトレボランダム再生リスト（新）https://youtube.com/playlist?list=PLqWJGDzD9emzSd8Ph2ShaTvJ-K94oK0rl【一言】１つボツにしたので投稿遅れましたよく使うBGMサイト魔王魂 DOVA-SYNDROME効果音：OtoLogic#ポケモン"
"udTuDdMbrfo","【限界生活】こんな毎日を送っています…小２男児との平日の夜に密着【ふたり暮らし】","2024-10-04T10:01:04Z","UCo9DVOXt3scEEqFN6_U5ZbQ","えぬくんちゃんねる","People & Blogs","24.15.10","[none]","271334","4679","0","255","https://i.ytimg.com/vi/udTuDdMbrfo/default.jpg","False","False","ほんとにカオスな毎日を送っております。😂😂こんな状態なので（普段はもっとひどい）撮影をしようとも思えなかったのですが…カオスな中でも嬉しいこと、おもしろいことたくさんあるな！って編集してて気づけました🥹！笑ってる場合じゃないよ！って感じかもしれないのですが🤣一歩進んで、二歩下がるような毎日ですが強く生きます。笑笑BGM：Vace Music Library https://vmp-vml.com/🌼えぬくんのInstagramはこちら🌼https://instagram.com/sum.722?utm_medium=copy_lin"
"UxwHkqkzm0o","Summering / じん【Official MV】","2024-10-03T10:00:24Z","UCP4sp1GUNCMAjktM3O-o9hg","じん OFFICIAL YOUTUBE CHANNEL","Music","24.15.10","じん|jin|カゲプロ|カゲロウ|カゲロウデイズ|カゲロウプロジェクト|しづ|初音ミク","983412","62092","0","2463","https://i.ytimg.com/vi/UxwHkqkzm0o/default.jpg","False","False","「拝啓、My Dxxr」Music：じんGuitar：じんBass：白神真志朗Drum：ゆーまお（ヒトリエ）Vocaloid Edit : びびVideo Direction：しづインスト音源はこちら：https://www.dropbox.com/scl/fo/7n5z37vhfgjx489wqeamn/AFiPSBLUXDxPsrbDvCG_ltc?rlkey=pn0z1pau7aap8di44ek9nmqgm&st=uoea9w8i&dl=0ダウンロード/ストリーミングはこちら：https://umj.lnk.to/jin_summeringIDじん公式X：https://twitter.com/jin_jin_suruyoじんスタッフ公式X： https://twitter.com/Jin_jin_shitayoじんオフィシャルサイト：https://jin-jin-suruyo.com/「Summering」歌詞入道雲は きっと紙に描いた 落書きでした嗄れた声は きっと聞き違いの 耳鳴りでした息が詰まる程目を覆いたくなる程全部が綺麗でした彼れを 如何と呼ぶんでしょう君は追想錆びた鉄橋人知れず 足を向けました湿気った匂いが きっと逸れ者の 逃げ場所でした薄い缶バッヂもすぐ剥がれたシールも全部 宝物だったのですいつしか、真面になったんだ其れが何でか、本当に時折、恐ろしくなるのですバイバイ、My D××r如何か、汚れないでいて真っ青な風景に繊細な儘でいて過ぎ去る夏が息を止めた頃に今更、後悔に 耽たのです降る、夕立に晴れ上がりが覗く厭に澄んだ 風合いと匂いのまま潸然、頰を打った群青に気が付けど悲しい哉、忽然と去ってしまうのです拝啓僕は きっと馬鹿にされるのが 嫌でした陰気な奴と ずっと虐められるのが 嫌でしただから、愛しくて手に余る物 全部を全部 置き去りに生きたのです降る、夕立に晴れ上がりが覗く吸って吐いた群青に溺れそうな程卑しい哉、思うのですずっと怱々バイバイ、My D××r如何か、忘れないでいて真っ青な風景に傷を遺していて過ぎ去る夏を何度も書き捨てて失う決心が 付いたのです入道雲は きっと僕の描いた 落書きでした歪んだ空も きっと一人分の 幻でした触れれば、痛む程目を背けたくなる程全部 本物に見えたのです#じん #しづ #初音ミク #Summering"
"ecAdQeJY6c8","オンマの容態が一向に良くならないので兄が帰って来ました","2024-10-04T09:58:23Z","UCZ2MfK6kPxHZZqp5FTZyv4g","李家everyday","People & Blogs","24.15.10","李家|李家everyday|everyday|家族|日常|韓国|文化|観光|韓国人家族|今日もGatti|リー君|サラ|オンマ|가티|사라|리쿤|한국인|일본유튜브|엄마","334097","10895","0","667","https://i.ytimg.com/vi/ecAdQeJY6c8/default.jpg","False","False","いつも見てくれてありがとうございます \(ㅇ__ㅇ)/♡⭐️INSTAGRAM⭐️サラの Instagramはこちら 【@2sall_gatti】https://www.instagram.com/2sall_gatti/えーへの Instagramはこちら 【@deko4cc】https://www.instagram.com/deko4cc/オンマの Instagramはこちら 【@onma1234】https://www.instagram.com/onma1234/⭐️チャンネル情報⭐️サラの新しいこちゃん⬇️【サラのHOKURO】https://www.youtube.com/channel/UCBVVCHhTq-tjHgcPvTkCFhw李家のTIKTOKはこちらで⬇️【@lee_ family99】https://www.tiktok.com/@lee_family99?えーへのチャンネル ⬇️【NOBLEMAN】https://www.youtube.com/channel/UCSHc05m3seGiDBH6ZChd1xA🐕ファンレター・プレゼントの宛先はこちら150-0001東京都渋谷区神宮前6-12-20J6 Frontビル 6F「株式会社carry on 李家every day」宛※冷蔵・冷凍が必要な、なま物の受付はできません。🐈お仕事のご依頼等https://carry0n.co.jp/contact/corporation/"
"I4Uo3vgaSM0","京本大我 – WONDER LAND","2024-10-03T12:00:28Z","UCwTl9t5_PnpFrL9fEXzOraA","京本大我 from ART-PUT","People & Blogs","24.15.10","[none]","1773591","41580","0","4036","https://i.ytimg.com/vi/I4Uo3vgaSM0/default.jpg","False","False","京本大我クリエイティブ・プロジェクト「ART-PUT」2nd Music Video「WONDER LAND」Music: Taiga Kyomoto, Keiichi OosawaLyrics: Taiga KyomotoArrangement: Keiichi OosawaMV Director: Riku OzamaMV Production: SEP,inc.#京本大我_WONDERLAND #TAIGA_KYOMOTO #ART_PUT▶京本大我 from ART-PUT HPhttps://art-put.com▶京本大我 Xhttps://x.com/TAIGA_KYOMO33▶ART-PUT Xhttps://x.com/art_put33▶見習いアーティスト Instagramhttps://www.instagram.com/minarai_artist/▶︎Subscribe 京本大我 from ART-PUT YouTube Channelhttp://www.youtube.com/@art-put"
