video_id,title,publishedAt,channelId,channelTitle,category,trending_date,tags,view_count,likes,dislikes,comment_count,thumbnail_link,comments_disabled,ratings_disabled,description
"TyvTFphP6as","【モンスト】※激難クエスト注意！まさかのキャラに救われた…《ガンダムシリーズコラボ超究極：シャア・アズナブル＆ナイチンゲール》 赤い彗星 激闘の軌跡 攻略","2024-10-11T11:01:31Z","UCz2HJColdSmAJU7dlqhSD8g","しゃーぺん","Gaming","24.15.10","しゃーぺん|モンスト|モンスターストライク|XFLAG|mixi|モンストニュース|コラボ|獣神化|ガチャ|爆死|神引き|超獣神祭|激獣神祭|上方修正|覇者の塔|新限定|超究極|新確定演出|リセマラ|EX|モンストの日|ラッキーモンスター|獣神化改|禁忌|アプデ|禁忌の獄|天魔の孤城|コネクトスキルの書|わくわくミンEL|しゃぺスト|追憶の書庫|深淵|ルシファー|10周年|真獣神化|黎絶|真獣神玉|ネオ|新春超獣神祭|マサムネ|スピニングブレイド|空中庭園|11周年|11周年イベント|ウリエル|轟絶感謝マルチガチャ|人気投票ガチャ|ガンダム|未開の砂宮|11周年轟絶感謝マルチガチャ|11周年人気投票ガチャ|ブリュンヒルデ|ハロハロ|ジョジョ|ジョジョの奇妙な冒険|11周年記念パック|ガチャリドラッシュ|シャア|シャア・アズナブル|ナイチンゲール|島津義弘|三途|リドーラ姫|ドン・ジョヴァンニ|トゥーランドット|アイーダ|ファミリーマート|ファミマ|けいうさ|ドゥームズデイ","280883","999","0","317","https://i.ytimg.com/vi/TyvTFphP6as/default.jpg","False","False","おためしメンバーシップ作りましたhttps://www.youtube.com/channel/UCz2HJColdSmAJU7dlqhSD8g/join素敵な画像、BGM、効果音などなど感謝です🙇・Audiostock…【 https://audiostock.jp/ 】・DOVA-SYNDROME…【 https://dova-s.jp/ 】・MusMus…【 http://musmus.main.jp/ 】・OtoLogic…【 https://otologic.jp/ 】・びたちー素材館…【 http://www.vita-chi.net/sozai1.htm 】▶チャンネル登録お願いします！⇒http://urx.red/H9kz▶良ければTwitterも…⇒https://twitter.com/syapenjikkyou#モンスト　#ガンダム　#シャア"
"nj9aXyv3fv4","保護してから4ヶ月一緒に過ごした子猫とついにお別れしたら猫たちがこうなっちゃいました…","2024-10-12T11:01:04Z","UCplhkHsYKxXjTde1lq8F-4w","もちまる日記","Pets & Animals","24.15.10","[none]","1031219","0","0","996","https://i.ytimg.com/vi/nj9aXyv3fv4/default.jpg","False","True","【補足】両親が、お世話に慣れるまでは茶太とおはぎとの生活に尽力したいとの意向だったため、今回はもちとはなは仲良しの友達にお留守番をお願いすることにしました。いきなり4匹が家に来たら父と母も慌ただしくなってしまうので、こうするのがベストだと思います。年末年始はもちとはなとも一緒に帰省し、また4匹揃う姿をお見せできると思います！⬇️メンバーシップへの参加はこちらhttps://www.youtube.com/@motimaru/join⬇️お問い合わせhttps://motimarunikki.com/contact⬇️公式HPhttps://motimarunikki.com/⬇️とん様https://amzn.asia/d/2ZjdpXL⬇️貢-mitsugu-プレミアムペーストhttps://mishone.jp/lp?u=mtg_pa_mochi_special⬇️オンラインストアhttps://motimaru.jp/⬇️公式LINE（限定動画配信中）https://lin.ee/BGMF0V6"
"qTJSwQd0rCw","岩田さんのこと 【雑談】","2024-10-11T11:00:57Z","UC5CTV3JSdrlo5Pa42QkK8SA","桜井政博のゲーム作るには","Gaming","24.15.10","ゲーム開発|ゲーム制作|ゲーム|桜井|カービィ|スマブラ|有限会社ソラ|任天堂|さくらい|桜井政博|仕事|雑談","307706","25809","0","1196","https://i.ytimg.com/vi/qTJSwQd0rCw/default.jpg","False","False","やはりチャンネル終了前には､この話題に触れないわけにはいきませんね｡31回に及んだ雑談カテゴリーは､これで最後です!!"
"gGOaQmJrNkQ","【感動】笑いあり涙ありのがーどまん&ふくれな結婚式がヤバかった","2024-10-10T10:00:48Z","UCI0xPNkgivK-FCcaCYDC8Yg","ヘラヘラ三銃士","Entertainment","24.15.10","[none]","697208","8259","0","259","https://i.ytimg.com/vi/gGOaQmJrNkQ/default.jpg","False","False","まもるん、れなち結婚おめでとうー💐💖​エガワ家⁠@エガワ家 ふくれな@fukurenaチャンネルがーどまん⁠@channelguardman1768《結婚式で歌ってた曲》https://youtu.be/sZhzbzf1Gss?si=5fv7xjs6npQ24g8A《🫧さおりんプロデュースのスキンケアコスメ》orinhttps://orin-cosme.com/《💅ありしゃんがオーナーのネイルサロン》Raviyhttps://beauty.hotpepper.jp/kr/slnH000313203/《👁まりなプロデュースカラコン》Ferennehttps://instagram.com/ferenne_official?igshid=OGQ5ZDc2ODk2ZA==💛ありしゃん💛（黄色担当）Instagram：@arishan.3Twitter : https://twitter.com/arishan_hera3個人CH：https://youtube.com/@hera3.arishan?si=TJoTawo0MGheB7iO💙さおりん💙（青担当）さおりんInstagram：@funacky325Twitter : https://twitter.com/aksb_funaki個人CH：https://youtube.com/@hera3.saorin?si=9hqwF7dHX0Zn9aPe💗まりな💗（ピンク担当）前略プロフ：https://twitter.com/marinachan_0205個人CH：https://youtube.com/@hera3.marina?si=5mI9yigc0RiCQwveアシスタント影井→https://youtube.com/channel/UC7P-6rjD76jNeKrd2o6ZwAwファンの呼び名：笑狂⚔（ヘラギャンって呼びます）（毎日エゴサしてるんで沢山書いてください）【ヘラヘラ三銃士リリース楽曲】https://www.tunecore.co.jp/artists/herahera3▼オフィシャルサイト・ファンクラブhttps://hera3.jp/＜ヘラヘラ三銃士のLINEスタンプがついに発売！＞■LINEスタンプはこちら！https://line.me/S/sticker/22523751【ヘラヘラ三銃士公式】公式LINE：https://lin.ee/NYPjG7Jファンクラブ：https://www.hera3.jp/TikTok：https://www.tiktok.com/@herahera3zyushiTwitter：https://twitter.com/hera3_youtubeInstagram：https://www.instagram.com/hera3.youtube/案件やコラボ依頼はこちらhera3.raviy@gmail.com"
"xKp54bunC_k","【地獄】赤字が膨れ上がってとんでもない額になりました","2024-10-10T17:50:00Z","UCL6JY2DXJNDOIqCP1CRADng","エガちゃんねる EGA-CHANNEL","Comedy","24.15.10","江頭|エガちゃん|エガちゃんねる|SAMURAI|BADASS|laugh","1670168","36192","0","2262","https://i.ytimg.com/vi/xKp54bunC_k/default.jpg","False","False","世界のEGA目指して江頭２：５０、頑張ります。「チャンネル登録、頼むぜ！」Egashira2:50 is a BADASS SAMURAI !!!Please subscribe !!!▼エガちゃんねる公式ショップ　https://egachannel.shop▼大井競馬場TokyoCityFleaMarket　By 東京リサイクル運動市民の会【次回開催】10月12日（土）、13日（日）9:00 - 14:30【WEB】http://www.trx.jp【Instagram】https://www.instagram.com/fleamarket_tokyorecycle▼サブチャンネル「エガちゃんねる〜替えのパンツ〜」    https://www.youtube.com/channel/UCU607BfClX724VqZZ9zWWcA?view_as=subscriber▼エガちゃんねる「ノーパン村」  https://www.youtube.com/channel/UCL6JY2DXJNDOIqCP1CRADng/join▼書籍『エガちゃんねる革命』（著：ブリーフ団D）   【Amazon】 https://www.amazon.co.jp/dp/4299025148   【楽天】　    https://books.rakuten.co.jp/rb/16982317/▼「エガちゃんねる」切り抜き動画を始めたい人はこちら！　https://forms.gle/tvSoW6Ze2GB4q7Gp7▼エガちゃんねる公式Twitter    https://twitter.com/samurai_badass▼エガちゃんねる公式Instagram    https://instagram.com/egachannel?igshid=1p9y690be4i5g▼エガちゃんねる公式TikTok　https://vt.tiktok.com/FsPEeK/▼お問い合わせはこちら     info@bampeiyu.com▼江頭2:50公式HP　http://bampeiyu-mgmt.com#江頭#エガちゃんねる#BADASS"
"-5_vkp9GMlM","【負ければ転落】昇格を懸けた試合でアクシデント連発。悔しさを抑えきれない槙野監督","2024-10-12T11:00:00Z","UCAJQh8OdbSAL-BMkuYsvvmg","槙野智章の俺じゃけん","Sports","24.15.10","槙野智章|サッカー|日本代表|浦和レッズ|レッズ|Jリーグ|俺じゃけん|ヴィッセル神戸|槙野智章 サッカー選手|サッカー選手|浦和|埼玉|槙野|槙野智章 年俸|槙野智章 インスタ|高梨 臨|槙野 髪型|プロフェッショナル|ケルン|超ポジティブ|プロサッカー|槙野 スター選手|槙野 プロサッカー選手|槙野 嫁|槙野 高梨|槙野 監督|槙野智章の俺じゃけん|槙野智章 対談|槙野 HALTEN|槙野 ラジオ|槙野 DAZN|槙野智章 DAZN|槙野 DAZNキャスター|槙野智章 DAZNコラボ|槙野 キャンプレポート|槙野 浦和レッズ|槙野 ヴィッセル神戸|槙野 社会人リーグ|槙野 品川CC|槙野 品川CC 監督","282729","2240","0","138","https://i.ytimg.com/vi/-5_vkp9GMlM/default.jpg","False","False","動画をご覧いただきありがとうございます！YouTubeを通して、皆さんにサッカーの素晴らしさ、スポーツの楽しさを届けていきます。私自身の活動、監督業もお届けしていきますので、この動画が良かったら、チャンネル登録&高評価を是非よろしくお願いします！槙野智章──────────────────────────【品川CC 公式HP】https://shinagawa.cc/【品川CC X】https://twitter.com/scc__football【品川CC Instagram】https://www.instagram.com/scc__football/────────────────────────── 【槙野智章 Instagram】https://www.instagram.com/makino.5_official/【槙野智章 X】https://twitter.com/tonji5【HALTEN(スタイリングブランド)】https://haltenjapanlimited.com/▼YouTubeに関するコラボやお仕事のご依頼は下記メールへmakino.orejaken@gmail.com──────────────────────────■企画・制作key MOVIE（for,Freelance株式会社）https://key-movie.forfreelance.co.jp/#槙野智章 #社会人サッカー#ドキュメンタリー#品川CC"
"Ou1UG_PC43Q","NEWS – チャンカパーナ [Official Music Video]","2024-10-09T12:15:02Z","UCj9f2amb1D0RuTNrBQ9GJoQ","にゅうちゅうぶ | NEWS official","Music","24.15.10","まっすー|シゲ|慶ちゃん|NEWS歌|weeeek|チャンカパーナ|urnotalone|ニュース|にゅーす|小山慶一郎|加藤シゲアキ|増田貴久|ジャニーズ|JAPANEWS|NEWS_JAPANEWS|METROCK|メトロック|さくらガール|さくらがーる|サクラガール|サマソニ|ロッキン|NEWS音楽|ラッキーフェス|フルスイング|イナズマロックフェス|starto|weare|KeiichiroKoyama|ShigeakiKato|TakahisaMasuda|エール|にゅうちゅうぶ|希望yell|にゅーちゅーぶ|ニューチューブ|NEWSニッポン|紅く燃ゆる太陽|チェリッシュ|てっぺん|テッペン|山下智久|山P|内博貴|taka|手越祐也|手越|テゴマス|錦戸亮|錦戸|草野博紀","1502598","69602","0","3955","https://i.ytimg.com/vi/Ou1UG_PC43Q/default.jpg","False","False","14th Single「チャンカパーナ」2012.07.18 Release「チャンカパーナ」作詞：Hacchin' Maya作曲：ヒロイズム編曲：CHOKKAKU▼「チャンカパーナ」配信はこちらhttps://NEWS-ELOV.lnk.to/advertising_artist_music_ChancapanaYT▼NEWS 配信一覧はこちらhttps://NEWS-ELOV.lnk.to/artist_musicYT◤NEWS 全500曲、サブスク解禁。◢NEWS 全シングル・アルバム配信中!!!【499+1】の物語。500曲目のアニバーサリーソング。NEWS 31st Single「あっちむいてほい」2024.11.13 Release & 11.4 サブスク先行配信https://NEWS-ELOV.lnk.to/acchi_muite_hoiYT□♡▽◯▼NEWS Official YouTubehttps://www.youtube.com/@NEWS0915_officialSTARTO ENTERTAINMENT Official Site https://starto.jp/news/NEWS ELOV-Label 公式HPhttps://www.elov-label.jp/s/je/artist/J0005NEWS ELOV-Label 公式Xhttps://twitter.com/NEWS0915_musicNEWS Bioリンクhttps://bio.to/NEWS_musicNEWS ファンクラブhttps://www.fc-member.familyclub.jp/#チャンカパーナ #NEWS #にゅうちゅうぶ"
"zbf6fjelcx8","【ご報告】なこなこカップル結婚しました！！","2024-10-10T11:00:08Z","UC75NfjEdgZ3BvqJ2ssCyHdg","なこなこチャンネル","Entertainment","24.15.10","なこなこ|カップル|TikTok|関西|ファッション|メイク|ドッキリ","929953","20742","0","1210","https://i.ytimg.com/vi/zbf6fjelcx8/default.jpg","False","False","2024年10月5日、７年記念日に無事に入籍しましたーーー！💍これでやっとなこなこ夫婦です♡みんないつもたくさんの応援ほんっとうにありがとうございます！！これからも夫婦としてよろしくお願いします👫❤️こーくんのべしゃり酒🍺https://youtube.com/@BESHARIZAKE?si=m4C6MvhP0mVxTc3jなごみ、個人チャンネル始めました！【nagomiチャンネル】➡︎https://www.youtube.com/watch?v=x_xYm2IPeY8【TikTok】➡https://www.tiktok.com/@nakonako1005🚺nagomi🚺　Twitter➡http://twitter.com/NAGOMI3232　Instagram➡https://www.instagram.com/__nagomi32__🚹こーくん🚹　Twitter➡http://twitter.com/koki10181005　Instagram➡http://www.instagram.com/koki.hj.20-----------------------------------------------------------------------ファンレター・プレゼントの宛先はこちら〒150-0001東京都渋谷区神宮前３丁目２１−８なこなこカップル宛※冷蔵・冷凍が必要な、なま物の受付はできません。お仕事のご依頼等➡info@nakonako.jp"
"-KjC2rezw5g","モンストニュース[10/10]ガンダムシリーズ第2弾コラボ追加情報や新限定キャラクター、新イベント「星演のスペース・オペラ」や「けいウサ」出現などモンストの最新情報をお届けします！【モンスト公式】","2024-10-10T07:00:06Z","UCd9BXPj-KcMTh0HiB-Vlb8A","モンスト（モンスターストライク）公式","Gaming","24.15.10","モンスト|モンスターストライク|Monster Strike|モンストニュース|獣神化|怪物彈珠|彈珠爆新聞|最新情報|モンスト最新|モンストの日|獣神化・改|ガンダム|コラボ|ガンダムシリーズ|シャア・アズナブル＆ナイチンゲール|逆襲のシャア|ベルトーチカ・チルドレン|金のハロガチャ|11周年轟絶感謝マルチガチャ|11周年ランク達成ミッション|ドゥームズデイ|爆絶|未開の砂宮|選抜！11周年人気投票ガチャ|中間発表|星演のスペース・オペラ|ドン・ジョヴァンニ|トゥーランドット|アイーダ|新イベント|リドーラ姫|けいウサ|激・獣神祭|三途|島津義弘|ジューシー祭|ファミリーマート|ファンと創るアクリルスタンド","710997","8449","0","667","https://i.ytimg.com/vi/-KjC2rezw5g/default.jpg","False","False","00:00 おさらい00:21 1. 「ガンダムシリーズ」第2弾 コラボ開催中！06:26 2. 11周年キャンペーンのおさらいとモンパスお試しキャンペーン！08:22 3. 新たな爆絶が降臨！09:52 4. 「未開の砂宮」が期間限定で登場！11:52 5. 「選抜！11周年人気投票ガチャ」中間発表〜！12:52 6. 新イベント「星演のスペース・オペラ」開催！18:55 7. 「リドーラ姫」のクエストが再登場！19:51 8. 激・獣神祭開催！新限定キャラクター登場！26:58 9. 来るぞ！獣神化・改！29:17 10. ファミリーマート×モンスト「ジューシー祭」開催！33:45 11. 新商品「ファンと創る アクリルスタンド」発売！◆ファミマ×モンスト「ジューシー祭」▼「ファミペイキャンペーン」詳細はこちら！https://www.family.co.jp/campaign/spot/2410_famipay-stamp_monster-strike_cp.html▼「ファミマスポットキャンペーン」詳細はこちら！https://www.monster-strike.com/news/20241010_3.html◆公式オンラインストア「モンストア」https://monstore.monster-strike.com/----------------モンストニュースはモンスト公式YouTubeチャンネルにて配信中！※営利目的による、本動画内の文章・画像等をはじめとした内容を引用元の記載無く無断転載及び複製等の行為はご遠慮ください。モンスト公式YouTubeチャンネルでは、獣神化やガチャ、轟絶などで降臨するモンスターの最新情報など、様々なモンスト動画を配信中！---------------▼モンストアプリのダウンロードはこちら・Android版https://play.google.com/store/apps/details?id=jp.co.mixi.monsterstrike・iOS版https://itunes.apple.com/jp/app/monsutasutoraiku/id658511662?mt=8▼モンスト公式YouTubeチャンネル登録はこちらhttps://www.youtube.com/user/monsterstrikepr▼オーブがモンストアプリ内よりもお得に購入可能！モンストWEBショップはこちらhttps://webshop.monster-strike.com/★モンスターストライク（モンスト）とは？  「モンスト」は、モンスターを指でひっぱって弾くだけの簡単操作で遊べる爽快アクションRPGアプリ！▼モンスト公式サイトhttps://www.monster-strike.com/▼モンスト公式Xhttps://twitter.com/monst_mixi▼モンストアニメ公式YouTubeチャンネルhttps://www.youtube.com/c/AnimeMonsterstrike▼モンソニ！公式YouTubeチャンネルhttps://www.youtube.com/@monsoni_official---------------★モンストの中の人とは？ アプリ「モンスターストライク」の魅力をユーザーさんに伝える仕事をしているモンストの運営スタッフです。☆もんすと放送局もあるよ☆https://www.youtube.com/@monst_cast　▼さなぱっちょ（モンストの中の人）　https://twitter.com/monst_sanapacho　▼ぱなえ（モンストの中の人）　https://twitter.com/monst_panaee　▼さしみ（モンストの中の人）　https://twitter.com/monst_sashimii　▼りえっくす（モンストの中の人）　https://twitter.com/monst_riex　▼ちゃす（モンストの中の人）　https://twitter.com/monst_chas　▼ゆきのしん（モンストの中の人）　https://twitter.com/xflag_yukinosin　▼たけちょり（モンストの中の人）　https://twitter.com/xflag_takechori　▼りるきい（モンストの中の人）　https://twitter.com/monst_rilkii　▼ほまれおん（モンストの中の人）　https://twitter.com/monst_homareon　▼ゆかんさ〜（モンストの中の人）　https://x.com/monst_yukansaa#モンスト #モンストニュース #最新情報 ©MIXI"
"JzhVp74fwqo","ネットで噂されている件について","2024-10-10T10:00:18Z","UCg4nOl7_gtStrLwF0_xoV0A","SeikinTV","Entertainment","24.15.10","セイキン|seikin|SeikinTV|TV|せいきん|セイキンTV|せいきんTV|YouTuber|ユーチューバー|兄弟|HIKAKIN & SEIKIN|ヒカキン & セイキン|ネット|インターネット|ネット上|噂|ウワサ|うわさ|報告|ご報告|日本HP|HP|PC|AI|ロボット|robot|存在しない説|操られてる説|AI説|偽物|偽者|ニセモノ|にせもの|本物|chatGPT|suno|heygen|premierepro|premiere pro|Adobe|編集|台本|作詞|作曲|楽曲|音楽","1285293","35637","0","966","https://i.ytimg.com/vi/JzhVp74fwqo/default.jpg","False","False","プロモーション：株式会社日本HPhttps://jp.ext.hp.com/aipc/intel/?jumpid=sc_st_cn_ytbr_seikin#IntelCoreUltra#IntelEvo＿＿＿＿＿＿＿＿＿＿SeikinTV チャンネル登録　　https://www.youtube.com/user/seikintv?sub_confirmation=1SeikinGames チャンネル登録https://www.youtube.com/user/seikingames?sub_confirmation=1X（エックス / 旧Twitter）http://twitter.com/SeikinTVTikTok（ティックトック）https://www.tiktok.com/@seikin_official?lang=ja-JPInstagram（インスタグラム）https://www.instagram.com/seikin_official/お仕事のご依頼、お問い合わせ等は下記、UUUM株式会社までお願いいたします。SNS等で本人へ直接のご連絡はお返事できかねますので予めご了承ください。https://www.uuum.co.jp/inquiry_promotion#セイキン"
"YI5sw8So2Rk","【大谷翔平】【ドジャース】ドジャース対パドレス 地区シリーズ  10/10 【野球実況】","2024-10-10T04:47:55Z","UCSDobaWqvIttZUa1xXi4sRQ","ハムショーのスポーツ実況ch","Sports","24.15.10","[none]","1474325","7597","0","48","https://i.ytimg.com/vi/YI5sw8So2Rk/default.jpg","False","False","大谷翔平　ドジャース　大谷翔平速報　2024年10月10日　ドジャース対パドレス戦を実況生配信でお送りします。サブチャンネルはこちら @dodgesho  Tシャツ・マグカップ・タオル　グッズショップはこちら！https://muuu.com/collections/42847-1031641UUUMのハムショー紹介ページはこちらhttps://uuum.jp/creator/hamushoプレゼントはこちらにお送りください！〒107-6228東京都港区赤坂9-7-1 ミッドタウン・タワー 28階ハムショー　宛※ お送りいただいたプレゼントはスタッフが開封確認をした後にクリエイター本人にお渡しいたします。※ 一度お送りいただいたファンレター・プレゼントは、原則としてお返しできません。※ 必ず【対象クリエイター名】を明記の上、お送り下さい。※ UUUMオフィスへの直接のお持込みはお断りさせていただきます。※ 危険物、飲食物、生もの、生き物、現金、金券（ギフトカード・プリペイドカード含む）などについては、スタッフの判断により、受け取りをお断りさせていただく場合がございます。あらかじめご了承ください。※ 送料不足、着払いなどでお送りいただいた場合は受け取ることができません。※ バレンタインデー、誕生日などの贈り物も、上記の注意点についてご確認をお願いいたします。DIGVOICEアプリDLリンク：https://digvoice.onelink.me/Wq6d/prr0xxh9スポンサー企業一覧野球ユニフォームのファンゴ様https://bit.ly/48W68jfブログ記事を書いていただきました！https://bit.ly/3Ppnhe9奥州いわい様からあげ家奥州いわいHP：https://iwai181.net/奥州いわいネットHP：https://iwai181.shop-pro.jp/マイプロテイン様【TEAMJP】入力で割引！注文はこちら→https://prf.hn/l/PlngzG5ネイチャーカン様Naturecan CBDサイト：https://bit.ly/3ubgUDVNaturecan フィットネスサイト：https://bit.ly/499VkP2クーポンコード【HAMUSHO】で10％オフ!!モデレーター応募フォームはこちら！https://forms.gle/d9tW5ALs18bcNPow6メンバーシップ始めました！スタンプ、コミュニティでの投稿、限定の動画、顔出しでの限定生配信、参加型配信などを予定しています！ご参加お待ちしています！https://www.youtube.com/channel/UCSDobaWqvIttZUa1xXi4sRQ/join基本的にはクレジットカード決済ですが、こちらの動画のやり方をすればクレジットカードなし、グーグルプレイカード(コンビニなどにあります)で携帯の機種問わず登録できます。https://youtu.be/N_Ak18km4WoX(旧Twitter)https://mobile.twitter.com/fighters28123Instagramhttps://www.instagram.com/fighters28123?igsh=MWpjcHlxbHQxZmJ2MQ%3D%3D&utm_source=qrTikTokhttps://www.tiktok.com/@fighters28123?_t=8kG9hcKltn5&_r=1こちらのフォローもお願いします！BGMはきゃすたぁわいるどさんの提供で使わせていただいています！https://youtube.com/c/%E3%81%8D%E3%82%83%E3%81%99%E3%81%9F%E3%81%81%E3%82%8F%E3%81%84%E3%82%8B%E3%81%A9音楽編集ソフトで打ち込んだ曲を使用しています。#大谷翔平  #ドジャース    #大谷翔平速報 　 #大谷翔平ライブ  #大谷 ＃ドジャースライブ  ＃大谷ライブ  ＃メジャー　＃大谷翔平速報今日 ＃ラジオ実況  ＃スポーツ実況  #mlb＃大谷ホームラン #ダルビッシュ有 #パドレス"
