video_id,title,publishedAt,channelId,channelTitle,category,trending_date,tags,view_count,likes,dislikes,comment_count,thumbnail_link,comments_disabled,ratings_disabled,description
"0opyaQPK6bY","GEMN「ファタール」 Performance Video (Prod. by Kento Nakajima)","2024-10-06T08:00:26Z","UCCy_q-N7F2FOIZ6ZggHIAKg","Sony Music (Japan)","Music","24.15.10","GEMN|ジェム|ファタール|Fatal|中島健人|Kento Nakajima|キタニタツヤ|Tatsuya Kitani|推しの子|Oshi no ko|赤坂アカ|横槍メンゴ|ヨルシカ|YOASOBI|Ayase|女王蜂|神曲|ヒット曲|アニメ|Anime|悪魔の踊り方|スカー|Scar|聖者の行進|青のすみか|Where Our Blue Is","787577","29455","0","1202","https://i.ytimg.com/vi/0opyaQPK6bY/default.jpg","False","False","GEMN(中島健人・キタニタツヤ)  “ファタール”(Fatal)TVアニメ『【推しの子】』第2期オープニング主題歌中島健人プロデュースによるパフォーマンスビデオStreaming / Download:  https://GEMN.lnk.to/FatalAYInst :    • ファタール (Inst) / GEMN - Fatal (inst) / https://www.youtube.com/watch?v=KrbyrIJ8XH8&t=0spiapro : https://piapro.jp/t/jiW9▼GEMN オフィシャルサイト▼URL : https://gemn-official.com/▼ファタール(Fatal) Music Video▼https://www.youtube.com/watch?v=8tQiWHXSGN0▼【推しの子】第2期ノンクレジットオープニング▼https://youtu.be/PAcf55v6zqQ::::::::::::::::::::::::::::::::::「ファタール」Words & Music : Tatsuya KitaniArrangement : GigaMix : Giga, Ayaka TokiMastering : Hidekazu Sakai (Sony Music Studios Tokyo)また夢から覚める、濡れた瞼を開ける狂おしいほど思い残す、遠い日の無力さを呪う身を焼かれるような絶望も糧にはなろうか憧れに焦がれるまま燃やし続けているキラキラお星様宿したあなたのeyesカラカラ渇いて可哀想なlack of 愛？全てを孤独から救う眩しい光僕にだけ落ちる影はあなたのせい？致命的な欠落をくれたね身勝手な巨星、狂わされた生お願い、声を聞かせて、声を聞かせて絡まって歪んでしまった傷さえくれたのはあなただけ、あなただけお願い、僕を見ていて、僕を見ていて宿命に刻まれた痛みさえ武器にしていつかの後悔すら照らせるようにあなたがいないと生きていけない何もかも捧げてしまってもいいあなたの愛がまだ足らない欠けたものは何で埋めたらいい？致命的、致命的、致命的な愛運命的、運命的、運命的なI必然的、必然的、必然的な哀僕を見ていてね、最愛のファタール！キラキラお星様宿したあなたのeyesカラカラ渇いて可哀想なlack of 愛？遥か彼方から放たれた美しさに灼かれた眼、もがれた羽根、創造的堕天あらゆる視界をジャックその輝きはエゴイスティック胸の奥仕舞った感情さえ引っ張り出して昇華して僕という運命を全部抱きしめていくあなたがいないと生きていけない眩しさでこの身を照らして欲しいあなたの愛がまだ足らない夢の中でもらうしかないのに致命的、致命的、致命的な愛運命的、運命的、運命的なI必然的、必然的、必然的な哀誰のものでもない、最愛のファタール！何度悔やんだだろう何度呪っただろうどれほどの幸福を注いだとしても満たされることのない器何度夢見ただろう何度願っただろう僕の胸で膿み続けている傷を撫でる手をこの舞台で足掻くことをやめないただ一つのアイに近づきたい固く定まったこの宿命あの星の光からこぼれた闇あなたがいないと生きていけない何もかも捧げてしまってもいいあなたの愛がまだ足らない欠けたものは何で埋めたらいい？致命的、致命的、致命的な愛運命的、運命的、運命的なI必然的、必然的、必然的な哀僕を見ていてね、最愛のファタール！最愛のファタール“Fatal”Waking up from another dream, I open my wet eyelidsI curse my helplessness from those far days which dreadfully remainWill this despair that burns my body feed me someday?I keep burning myself from it as I crave adorationYour eyes with glittering stars in them All dried up, poor thing, a lack of love?  A dazzling light that saves all from lonelinessIs this shadow that falls only on me because of you?You have given me a fatal flawSelfish giant star, ruined livesPlease, let me hear your voiceEven these tangled and twisted woundsYou're the only one who gave them to mePlease, keep your eyes on meI'll weaponize even the pain carved by fate So that it can light the regrets from sometimeWithout you, I cannot live anymoreI would sacrifice anything for youI can’t get enough of your loveWhat should I use to fill in what’s missing?Fatal, fatal, fatal loveFatal, fatal, fatal IFatal, fatal, fatal sorrowKeep your eyes on me, my dearest fatale!Your eyes with glittering stars in themAll dried up, poor thing, a lack of love?  Your beauty radiating from far away causingBurnt eyes, stripped feathers, creative fall from heavenTaking over every field of visionYou shine egoisticallyEven the feelings kept deep in my heartI will drag them out and sublimateAnd I will embrace all of my destinyWithout you, I cannot live anymoreI want your dazzlement to light up my bodyI can’t get enough of your loveEven though I can only get it in my dreamsFatal, fatal, fatal loveFatal, fatal, fatal IFatal, fatal, fatal sorrowYou don’t belong to anyone else, my dearest fatale!How many times have I regretted it?How many times have I cursed it?No matter how much happiness I pour intoThis vessel will never be filledHow many times have I dreamed of it?How many times have I wished for it?For your hands to caress the wound that continues to fester in my chestI will not stop to struggle on this stageI want to get closer to the only [ai]This foreordained destiny It's the darkness that fell out from the light of that starWithout you, I cannot live anymoreI would sacrifice anything for youI can’t get enough of your loveWhat should I use to fill in what’s missing?"
"SPRdbXaHI2w","馴れ合う気はない！BreakingDown13.5の舞台裏でも、この2人がバチバチにやり合っていたwww","2024-10-07T11:00:28Z","UCP4zT2rANBl529Nl42erGvQ","【公式】BreakingDown / ブレイキングダウン","Entertainment","24.15.10","BreakingDown|朝倉未来|朝倉海|ブレイキングダウン|ブレイキングダウンオーディション|オーディション|ブレイキングダウン公式|BreakingDown公式|井原良太郎","385685","2904","0","779","https://i.ytimg.com/vi/SPRdbXaHI2w/default.jpg","False","False","▼【PPVアーカイブチケット 980円】公式アプリVIP会員なら全試合視聴無料！https://bit.ly/3TI3ed4▼スポンサー応募・詳細はこちらからhttps://backstage.inc/breakingdown/sp▼BreakingDown公式アプリ衝撃のオーディション未公開映像配信予定！https://breakingdownlive.page.link/dl3▼BreakingDownボランティア・正社員の募集はこちらからhttps://forms.gle/z4nyRcPci3Mawk6s6▼BreakingDown公認切り抜きの応募はこちらからhttps://docs.google.com/forms/d/1sMMAeXr0eh3U64OUAac9dN0Evym27Qq-R1coUZVYoZw/viewform?edit_requested=true▼BreakingDown13.5 メインスポンサー ポスティングテクノロジーズ様https://postech.co.jp/▼BreakingDown13.5 シルバースポンサー INSTEP様https://instep.chat/▼BreakingDown13.5 シルバースポンサー HTF様https://h-t-f.shop/▼BreakingDown13.5 シルバースポンサー 未来の育毛剤VO-VO-様https://vovo-official.jp/▼BreakingDown13.5 シルバースポンサー H.L.B様https://hlb.ink/▼BreakingDown13.5 シルバースポンサー PREWAN様https://prewan.co.jp/▼BreakingDown13.5 シルバースポンサー Mr.STICK様https://mrstick.jp/▼BreakingDown13.5 シルバースポンサー エメルテクリニック様https://aimerte-clinic.com/aimerte/lp-f6ifmty-12.html▼BreakingDown13.5 シルバースポンサー T-CLINIC様https://tclinic-official.com/▼BreakingDown13.5 シルバースポンサー ザ・スカルプ様https://tclinic-official.com/lp_scalpairmedical_01/▼違法動画報告専用フォームhttps://forms.gle/wcw2GVADf9GLcqxc7※Breaking Downでは各プラットフォームと連携して違法動画の対策と撲滅をしていきます。悪質な違法アップロードに関しては法的措置も行います。"
"QJceple_ZNY","MISAMO「NEW LOOK」MV Dance Teaser","2024-10-08T12:00:35Z","UCCRb6nYKaT8tzLA8CwDdUtw","TWICE JAPAN OFFICIAL YouTube Channel","Music","24.15.10","TWICE|トワイス|トゥワイス|ナヨン|ジョンヨン|モモ|サナ|ジヒョ|ミナ|ダヒョン|チェヨン|ツウィ|K-POP|TT|ONCE|트와이스|ミサモ|ダンス","357087","30928","0","700","https://i.ytimg.com/vi/QJceple_ZNY/default.jpg","False","False","2024.11.6 Release MISAMO JAPAN 2nd MINI ALBUM『HAUTE COUTURE』MISAMO「NEW LOOK」MV Dance Teaser【いい音楽で一度、素晴らしいパフォーマンスで二度魅了させる】と言う意味を持つ、Asia No.1最強ガールズグループTWICEの日本人メンバーMINA、SANA、MOMOの3名からなるユニットMISAMO。アルバムに収録されるサブリード曲「NEW LOOK」のMV Dance Teaserが公開！「NEW LOOK」は安室奈美恵氏が2008年にリリースした楽曲。今回MISAMOが、カバーという形で再現。MV本編公開にも乞うご期待！！---------------------------------「NEW LOOK」HOLLAND EDDIE / HOLLAND BRIAN / DOZIER LAMONT HERBERT / T.KURA / MICHICO©STONE AGATE MUSIC Permission granted by SONY MUSIC PUBLISHING (JAPAN) INC.©️2008 avex music publishing Inc. & Rising Publishers Co., Ltd & Sony Music Publishing (Japan) Inc.---------------------------------MISAMO JAPAN 2nd MINI ALBUM『HAUTE COUTURE』特設サイト：https://www.twicejapan.com/feature/HAUTECOUTURE---------------------------------TWICE OFFICIAL FANCLUB ONCE JAPANhttp://oncejapan.comTWICE JAPAN OFFICIAL SITEhttp://www.twicejapan.comTWICE JAPAN OFFICIAL TWITTERhttps://twitter.com/jypetwice_japanTWICE JAPAN OFFICIAL INSTAGRAMhttps://www.instagram.com/jypetwice_japan/TWICE JAPAN OFFICIAL YouTube Channelhttps://www.youtube.com/c/twicejapanofficialTWICE JAPAN OFFICIAL TikTokhttps://www.tiktok.com/@twice_tiktok_officialjp---------------------------------"
"NOaCsCp_3lA","#359【交渉!!】出演お願いしたらとんでもない人に繋がった日","2024-10-06T08:00:10Z","UC2alHD2WkakOiTxCxF-uMAg","よにのちゃんねる","Entertainment","24.15.10","[none]","2864665","79106","0","3777","https://i.ytimg.com/vi/NOaCsCp_3lA/default.jpg","False","False","皆様、こんばんは♪よにのちゃんねるです!!!!先週もお疲れ様でした🙇‍♂️なんか1週間が早く過ぎ去ります、、、、気が付いたら、、、ってやつですわ！しかも今日はDASHとニノさんとあそぼもありますので併せて楽しんで頂けたら幸いでございます！…という事で、本日の動画もお楽しみください♪#よにの #ゲストブッキング #風磨の父"
"Kal1CH40IMk","【神回】失格のルールを追加し続けたら、混乱の末に爆笑の奇跡が起きた【生き残れ！】","2024-10-07T09:00:27Z","UCQ_MqAw18jFTlBB-f8BP7dw","QuizKnock","Entertainment","24.15.10","クイズ|東大|伊沢拓司|クイズノック|quizknock","1059004","44022","0","3204","https://i.ytimg.com/vi/Kal1CH40IMk/default.jpg","False","False","厳しすぎるルールに耐えて生き残れ！伊沢、須貝、山本、鶴崎、田村、乾、問、言、川上が挑戦！今日の一問の答えはこちら↓記事タイトル:「ハイタッチ」は海外で通じない！英語で「ハイ何」？【今日の一問】https://web.quizknock.com/kyoichi-eigo-10500問耐久クイズは2024年10月13日(日) 12時30分から生配信！↓詳細はこちらから！↓https://x.com/QuizKnock/status/1828734279008108670ーーーーーーーーーーーーーーーーーーーートーキョーディスカバリーシティ！2024 不思議な扉と100の謎2024年9月19日（木）〜2024年11月17日（日）まで、東京ドームシティを舞台にQuizKnockが制作する謎解きイベントが開催中！https://x.gd/LViJLーーーーーーーーーーーーーーーーーーーー◆フォロワークラブ「QuizKnock schole」https://quizknock-schole.com/◇もっと学びを応援するチャンネル「QuizKnockと学ぼう」https://www.youtube.com/c/QKmanab◇ゲーム実況チャンネル「GameKnack」（ゲームナック）https://www.youtube.com/c/QKgameknack◇QuizKnockサブチャンネルhttps://www.youtube.com/c/QKkaigi◆公式Xアカウント伊沢拓司＠tax_i_ (https://twitter.com/tax_i_)ふくらP @fukura_p (https://twitter.com/fukura_p)河村拓哉@kawamura_domo (https://twitter.com/kawamura_domo)須貝駿貴@Sugai_Shunki (https://twitter.com/Sugai_Shunki)山本祥彰@quiz_yamamoto (https://twitter.com/quiz_yamamoto)鶴崎修功@Tsurusaki_H (https://twitter.com/Tsurusaki_H)東問@Mon_Higashi (https://twitter.com/Mon_Higashi)東言@Gon_Higashi (https://twitter.com/Gon_Higashi)乾@QK_inui (https://twitter.com/QK_inui)田村正資@kaiseitamura (https://twitter.com/kaiseitamura)川上諒人@ry_kawakami (https://twitter.com/ry_kawakami)クイズノック＠QuizKnock (https://twitter.com/QuizKnock)◆QuizKnock LINE公式アカウントhttps://lin.ee/JMSq7TlR◆お問い合わせhttps://www.portal.quizknock.com/contact◆二次利用についてのお知らせhttps://www.portal.quizknock.com/request◆素材提供OtoLogic様→https://otologic.jpポケットサウンド様→https://pocket-se.info/魔王魂様→https://maoudamashii.jokersounds.com/フリーBGM・音楽素材 MusMus様→http://musmus.main.jp/PIXTA様→https://pixta.jp/◆スタッフ企画監督：直井企画：直井問題制作：直井,森慎太郎,岡﨑爽,藤田創世,大塚澄佳撮影：多加野真白,東堂りお,栗原侑子,飯島翼,日下菜美編集監督：友成萌編集：友成萌校正：戸松彩,混杉爽校閲監督：井口凜校閲：大塚澄佳サムネイル制作：つるぎ監修：ふくらP,森慎太郎ーーーーーーーーーーーーーーーーーーーーQuizKnock powered by baton"
"RBYI22lII_o","【素敵なご報告】最愛の人が出来ました","2024-10-08T09:00:22Z","UC642pLj4GXSj-0Ybdx3ytmA","カジサック KAJISAC","Entertainment","24.15.10","カジサック|KAJISAC|キングコング|キンコン|梶原|西野|吉本|お笑い|芸人|Youtuber|OmO|カジサックの部屋|吉本興業|かじさっく","544959","12850","0","2220","https://i.ytimg.com/vi/RBYI22lII_o/default.jpg","False","False","編集者：グドール励ドッキリ・サプライズ編の動画はこちら！https://www.youtube.com/playlist?list=PLJGNP79A-DcI5phxfyZJbBXx2xI8ZGlTa10/6（日）「カジサック6周年祭り〜カジサックファミリー・ツネファミリー・りおちゃんもくるよ〜」配信チケットの販売はこちら！https://online-ticket.yoshimoto.co.jp/products/kajisac6syunen-ol★カジサック（梶原雄太）著書「家族。」ご購入は下記からぜひお願いします。Amazonはこちらhttps://www.amazon.co.jp/dp/447811465X/Audible版はこちらhttps://www.amazon.co.jp/dp/B0C6Q4L8RR楽天ブックスはこちらhttps://books.rakuten.co.jp/rb/17171707/※緊急事態宣言解除後の撮影につきまして検温・手指の消毒の義務化や換気の徹底など感染拡大の防止対策に取り組んだ上で撮影を行なっております。吉本興業所属のキングコング梶原が、新米Youtuberカジサックとなって色んなことを学ぶチャンネルです。毎週火曜、木曜、土曜、日曜の18時を目安に動画をアップしています。※他の曜日もアップされる可能性もあります。★復活したTwitterアカウントはこちら！https://twitter.com/kajisac_onashasカジサックのTikTokはこちら！https://www.tiktok.com/@kajisac_roomカジサック公式アプリ「カジサックの楽屋」のインストールはこちらから！▼iOShttps://apps.apple.com/app/id1473420400▼Androidhttps://play.google.com/store/apps/details?id=com.c_rayon.kajisac★カジサックのLINEスタンプはこちらhttps://line.me/S/sticker/7343752★カジサック&ヨメサックのinstagramはこちらhttps://www.instagram.com/kajisac_yomesac/★ちょっとでも面白かったらぜひチャンネル登録をお願いします！→  http://www.youtube.com/channel/UC642pLj4GXSj-0Ybdx3ytmA?sub_confirmation=1【新チャンネル】カジサックが切り抜く部屋はこちら→https://www.youtube.com/channel/UC9R1Lkqwhzjf7-uu2iXusqAサブチャンネル（「カジサック の小部屋」）はこちら→ http://www.youtube.com/channel/UCdEpbrlHoqnUGMRy2LICtRw?sub_confirmation=1カジサックのゲーム部屋はこちら→https://www.youtube.com/channel/UCaweVLFU1fA7C3HQwmQNLDA梶原雄太の部屋はこちら→https://www.youtube.com/channel/UCwoMkWY2z_-i2egjuzTXYrQカジサックのTikTokアカウントはこちらhttps://www.tiktok.com/@kajisac_roomカジサックの冠番組『カジサックのじゃないと！』HPはこちらhttp://www.kkt.jp/program/janight/番組公式Twitterはこちらhttps://twitter.com/k_janightTVerとhuluでも見逃し配信中！Tver：https://tver.jp/feature/f0048217hulu：https://www.hulu.jp/kajisac-no-ja-night#カジサック #KAJISAC #カジサックの部屋 #KAJISACROOM #OmO #吉本興業ーーーーカジサック の人気動画５選１。　Nonstyleの石田さんと語りました　　　https://www.youtube.com/watch?v=wDgh3nc4Yds２。　丸一日ママになってみました　　　https://www.youtube.com/watch?v=rxddtDfnIB0３。　同期の南海キャンディーズ山ちゃんとガチンコトーク　　　https://www.youtube.com/watch?v=M2G6gkWDsqU４。　【大事故】タメ口ドッキリを仕掛けたらココリコ遠藤さんにガチでキレられましたhttps://www.youtube.com/watch?v=IY3BpJ-H1wY"
"DanuWvOFiaw","【超人】50時間以上ぶっ通しで立ち続けた結果、改造人間が誕生しました。#4【二泊三日座ったら即帰宅/チャリ旅/スポーツ/対決/大食い/グルメ/地獄/過酷/相撲/深夜/旅行】","2024-10-07T11:00:20Z","UCP-32CzsbLiiIb2LbYk8mZA","Lazy Lie Crazy【レイクレ】","Comedy","24.15.10","レイクレ|ともやん|急上昇|コムドット|どば師匠|てっちゃん|たかし|ぺろ愛男爵|東海オンエア|フィッシャーズ|神回|はじめしゃちょー|エスポワール|平成フラミンゴ|Youtuber|新世代|TikTok|お笑い|れいくれ|面白い","837832","15873","0","772","https://i.ytimg.com/vi/DanuWvOFiaw/default.jpg","False","False","48時間限定でレイクレ×シャインマスカットはこちらから購入できます！▼購入はこちらから！https://item.rakuten.co.jp/gurutan/n01shi5090/発売日：本日2024年10月7日（月）18:00~10月9日（水）18:00まで！価格：5,090円(税込)特典：レイクレトレーディングカードがランダムで1枚入り（全6種類）■2泊3日座ったら即帰宅の旅行1話 https://youtu.be/JXLuvHQPg_Y2話 https://youtu.be/25ZzPipwRgg3話 https://youtu.be/KLWuF1pvwSU4話 https://youtu.be/DanuWvOFiaw＝＝＝サブチャンネルも登録よろしくな！！■深夜のレイクレhttps://www.youtube.com/@Lazy_Lie_Crazy_Sub■レイクレGAMEShttps://www.youtube.com/@Lazy_Lie_Crazy_Games■お問い合わせ/お仕事の依頼はこちらから【info@sai-oh.jp】■個人チャンネルはこちら！どば師匠→https://www.youtube.com/@レイクレどば師匠-o1fてっちゃん→https://www.youtube.com/@jcinema5068ともやん→https://www.youtube.com/@tomoyan6たかぺろFM107→https://www.youtube.com/@user-ku5kh9qt3z■各種SNSはこちら！【Instagram】Lazy Lie Crazy【レイクレ】→https://www.instagram.com/lie_lazy090/どば師匠→ http://instagram.com/lazy_doba/たかし→ https://www.instagram.com/t_kashi_dayoてっちゃん→ https://www.instagram.com/tttigrisx/ともやん→ http://instagram.com/tmyndayo/ぺろ愛男爵→ https://instagram.com/peroai/【X (旧Twitter)】Lazy Lie Crazy【レイクレ】→https://twitter.com/lie_lazyどば師匠→ https://twitter.com/lazy_dobaたかし→  https://twitter.com/t_kashi_dayoともやん→  https://twitter.com/tmyndayoてっちゃん→  https://twitter.com/llc_tecchanぺろ愛男爵→  https://twitter.com/peroaidanshaku1【TikTok】Lazy Lie Crazy【レイクレ】→https://www.tiktok.com/@lie_lazyどば師匠→ https://www.tiktok.com/@lazy_dobaたかし→https://www.tiktok.com/@lazy_takashiてっちゃん→ https://www.tiktok.com/@llc.tecchanともやん→ https://www.tiktok.com/@tmyndayoぺろ愛男爵→ https://www.tiktok.com/@peroai■動画エンディングhttps://youtu.be/-nuCJRN1YDo＝＝＝＝レイクレ＆ともやん個人チャンネル＆深夜のレイクレ切り抜きプロジェクトへの参加をご希望の方は下記フォームからご応募お願いします！その後、事務を代行するAnyMind Japan株式会社よりご連絡を差し上げますのでその説明に従ってください。（返信は平日の日中のみ、土日祝祭日はお休みとなります。）切り抜きプロジェクトの応募フォームはこちら↓https://forms.gle/UT3QzSSb3JQG5xvR7※切り抜きプロジェクトに関するお問合せは応募フォームに記載のメールアドレス（lazy~.com）にお願いします。＝＝＝＝"
"oizy5PP9pfI","習近平氏の思惑は…台湾有事で日本は戦争に巻き込まれるのか！？(テーマ別)【そこまで言って委員会NP｜2024年9月29日放送】","2024-10-06T06:00:25Z","UCFf21op6Q2OG_H7-pQmCc_Q","【公式】そこまで言って委員会NP","Entertainment","24.15.10","そこまで言って委員会|ytv|読売テレビ|よみうりテレビ","342660","3174","0","579","https://i.ytimg.com/vi/oizy5PP9pfI/default.jpg","False","False","\そこまで言って委員会NPを無料配信中/※この動画は2024年9月29日に放送したものです★チャンネル登録★はこちら⇒https://bit.ly/3bZbddE【司会】黒木千晶　野村明大【パネリスト】竹田恒泰　石川和男　田嶋陽子　丸田佳奈門田隆将　井上和彦　峯村健司　宮家邦彦近藤大介　石平そこまで言って委員会　全編公開https://www.youtube.com/playlist?list=PLC3Z1ro8fJEu-eGHmdbi_ZT-8N3Tlx49fそこまで言って委員会　テーマ別https://www.youtube.com/playlist?list=PLC3Z1ro8fJEu-qJUkxgEF2Cu5N89rQeIjそこまで言って委員会　ＷＥＢでも言って委員会https://www.youtube.com/playlist?list=PLC3Z1ro8fJEt_n0RwsY1SdVFdHj_RdiIm▼番組テーマ５２年前の今日、日中の国交が正常化した。当時の判断は本当に正しかったのか！？中国の台湾侵攻が始まったら日本はどうなる？東アジアの未来について専門家と共に徹底討論Ｗｅｂサイト限定のオリジナル動画コンテンツ。番組収録後、パネラーに突撃インタビュー！素顔のパネラーが見せる本音トークを動画で配信！限定映像をどうぞお見逃しなく！★そこまで言って委員会NP 公式ＨＰ★https://www.ytv.co.jp/iinkai/▼番組詳細政治から芸能まであらゆるテーマをメッタ斬り! 黒木千晶 （議長）野村明大（秘書室長）と共に毎週パネラーやゲストを迎え政治・経済等をテーマに討論する番組「そこまで言って委員会NP」。日本全国『いつでもどこでも』期間限定で無料視聴できます！議長：黒木千晶 秘書室長：野村明大#そこまで言って委員会 #討論 #黒木千晶 #野村明大#竹田恒泰 #石川和男 #田嶋陽子 #丸田佳奈 #門田隆将 #井上和彦 #峯村健司 #宮家邦彦 #近藤大介 #石平▼そこまで言って委員会NP公式サイトhttps://www.ytv.co.jp/iinkai/ ▼ytv MyDo!【そこまで言って委員会NP】https://www.ytv.co.jp/mydo/iinkai/"
