video_id,title,publishedAt,channelId,channelTitle,category,trending_date,tags,view_count,likes,dislikes,comment_count,thumbnail_link,comments_disabled,ratings_disabled,description
"FdBnvmLOuiM","#Akhanda2 - Thaandavam  🔱 Title Theme | Balakrishna | Boyapati Srinu | Raam Achanta | Gopi Achanta","2024-10-16T05:13:46Z","UC6oaZCtrOI-cmrVgNkc0c3g","14 Reels Plus","Film & Animation","24.20.10","[none]","1072000","42125","0","1149","https://i.ytimg.com/vi/FdBnvmLOuiM/default.jpg","False","False","Watch Akhanda2 - Thaandavam  🔱 Title Theme God Of Masses Nandamuri Balakrishna, Blockbuster Maker Boyapati Sreenu, Raam Achanta, Gopi Achanta, 14 Reels Plus, M Tejaswini Nandamuri Presents #BB4 Titled Akhanda 2#NandamuriBalakrishna #BoyapatiSreenu #Akhanda2 #Akhanda2Thaandavam #Akhanda2TitleTheme #Akhanda2MotionPosterCast: God Of Masses Nandamuri BalakrishnaTechnical Crew:Writer, Director: Boyapati SreenuProducers: Raam Achanta, Gopi AchantaBanner: 14 Reels PlusPresents: M Tejaswini NandamuriMusic: Thaman SDOP: C Ramprasad, Santoshh D DetakaeArt: AS PrakashEditor: TammirajuPRO: Vamsi-ShekarMarketing: First Show"
"OW6eA-o_Rts","Kaffara 2nd Last Episode 89 - [Eng Sub] - Ali Ansari - Laiba Khan - Zoya Nasir - 16th October 2024","2024-10-16T17:00:19Z","UCe9JSDmyqNgA_l2BzGHq1Ug","HAR PAL GEO","Entertainment","24.20.10","latest pakistani drama|top pakistani dramas|best pakistani dramas|drama 2024|pakistani drama|har pal geo|pakistani dramas 2024|pakistani drama ost|best pakistani ost|ost drama 2024|पाकिस्तानी सीरियल|पाकिस्तानी ड्रामा|Ali Ansari|Laiba Khan|Zoya Nasir|Ali Ansari New Drama|Kaffara New Drama|pakistani drama kaffara|kaffara ost|kaffara episode 89|kaffara drama 89|kaffara ep 89|#kaffara|#kaffara89|16th October 2024|ED-AA-UL-AA-CC-AA-TH-AA|Kaffara Ost","11997401","221898","0","8196","https://i.ytimg.com/vi/OW6eA-o_Rts/default.jpg","False","False","Thanks for watching Har Pal Geo. Please click here https://bit.ly/3rCBCYN to Subscribe and hit the bell icon to enjoy Top Pakistani Dramas and satisfy all your entertainment needs. Do you know Har Pal Geo is now available in the US? Share the News. Spread the word.Kaffara 2nd Last Episode 89 - [Eng Sub] - Ali Ansari - Laiba Khan - Zoya Nasir - 16th October 2024 - HAR PAL GEOSitara, a lively orphan living with her brother, aunt, and uncle, finds joy in life's small things despite her aunt's poor treatment. Her aunt keeps her around because she has a share in the family's property.Salar, the son of a wealthy businessman, is passionate about photography, which often earns him criticism from his family. With a pure heart, Salar is known for evading his responsibilities.At her cousin's wedding, Sitara wrongly assumes Salar is the photographer. Salar develops a soft spot for Sitara after seeing how poorly she is treated. However, due to a conspiracy, objections arise about their closeness. Salar, once again, avoids the issue, leaving Sitara to face doubts from her own family.Can Sitara prove she’s not guilty? Will Salar help her avoid further mistreatment? Will her family support Sitara? Can Salar show he genuinely cares? Will there be more plots against Sitara?7th Sky Entertainment Presentation Producers: Abdullah Kadwani & Asad Qureshi Director: Muhammad Iftikhar IffiWriter: Shafia KhanCast :Ali Ansari as SalarLaiba Khan as SitaraZoya Nasir as Nimi Aliya Ali as SabaYasir Shoro as SalmanJunaid Akhtar as EhtishamFawad Jalal as JunaidRaeed Muhammad Alam as QasimZohreh Amir as ZoyaSadaf Aashan as ShahidaRashid Farooqui as ShaukatBakhtawar Khan as SahibaAnnie Zaidi as MehreenUsman Peerzada as TahirReham Rafiq as KiranNazlee Nasr as NajmaMohsin Gillani as Mirza SahabShaheen Khan as SuraiyaSami Khan as ZohaibSajida Syed as ZairaFareeha Jabeen as Khala BiShabana Shaikh as Zehra#kaffara #laibakhan #aliansari"
"6AwtBxjG_5Q","2024 Best Minecraft Facts","2024-10-17T11:32:17Z","UCoYZ3nrf-xiVEi93vmn6m-Q","MrGamerJay","Gaming","24.20.10","minecraft|minecraft facts you didn't know|minecraft facts|minecraft video|minecraft game","256496","7454","0","275","https://i.ytimg.com/vi/6AwtBxjG_5Q/default.jpg","False","False","👾 Discord: https://discord.com/invite/mrgamerjay🧡 Instagram:https://www.instagram.com/mrgamerjay/🟦 Facebook :https://www.facebook.com/profile.php?id=100069745845736"
"hO7F7pOra9g","Dipika Ne Shoaib Aur Mere Liye Banaya Delicious Achari Chicken! | @FarahKhanK","2024-10-18T07:30:14Z","UChCYMXLO_SfiNwOc2rlNKCA","Farah Khan","People & Blogs","24.20.10","farah khan|farah khan youtube channel|farah khan director|farah khan kunder|farah khan viral recipes|farah khan food recipes|farah khan vlog|farah khan yt channel|farah khan food vlog|food with farah|food vlog|dipika kakar|dipika kakar ibrahim|dipika kakar and shoaib ibrahim|shoaib ibrahim|dipika shoaib|dipika kakar son|ruhaan ibrahim|achari chicken recipe|achari chicken|chicken achari recipe|dipika kakar cooking|dipika kakar and farah khan","1809357","61567","0","3493","https://i.ytimg.com/vi/hO7F7pOra9g/default.jpg","False","False","Get FLAT 20% OFF on OZiva Hair Growth Actives. Use Code: FARAH. Link to SHOP https://bit.ly/3A1l0BtAaj ke vlog mein special mehmaan hain Dipika Kakar, Shoaib Ibrahim, aur unka pyaara beta Ruhaan! Dipika bana rahi hai humare liye Achari Chicken ki tasty recipe, aur saath mein humari fun masti bhi dekhiye!Don't forget to subscribe and hit the notification bell so you never miss out on my latest recipes and cooking adventures!Click here to subscribe my channel:- https://www.youtube.com/channel/UChCYMXLO_SfiNwOc2rlNKCA?sub_confirmation=1Brand Enquiry: farah.khan@qyuki.comAlso follow me on:-Instagram - https://www.instagram.com/farahkhankunder/Twitter - https://twitter.com/thefarahkhan?lang=enFacebook - https://www.facebook.com/TheFarahKhan#farahkhan #dipikakakar #shoaibibrahim #acharichicken"
"UWJMKH92Iwo","লোকক্ষ্মী এলো ঘোরে | Gopal Bhar | Episode - 1092","2024-10-18T07:00:31Z","UCBz9qbqujcjIavFmBJW2oZw","Sony AATH","Entertainment","24.20.10","aath sunday shows|animated comedy serial|gopal bhar classic episodes|gopal bhar latest episode|gopal bhar episodes|gopal bhar on AATH|aath bangla|animated show|best of gopal bhar|gopal bhar comedy scenes|sony aath|Gopal bhar bengali|bangla show|raja krishna chandra|animation|bengali channel|bengali animated serial|gopal bhar funny clips|bangla|sunday funday|funny episode|gopal bhar funny videos|gopal bhar|double gopal|Gopal Bhar full episode 1092","860061","13016","0","548","https://i.ytimg.com/vi/UWJMKH92Iwo/default.jpg","False","False","Click here to Subscribe to SONY AATH Channel: https://www.youtube.com/channel/UCBz9qbqujcjIavFmBJW2oZw?sub_confirmation=1Gopal requests Ranima to help the people of the kingdom organize Lokkhi Pujo. Will Ranima agree to help him?Show Name: Gopal Bhar - গোপালভাঁড়Directed By: Sourav Mondal, Hansa MondalWritten By: Hansa MondalOriginal language: BengaliEpisode No: 1092#GopalBhar #sonyaath #গোপালভর About Gopal Bhar:-----------------------------Gopal Bhar was a legendary court jester in medieval Bengal. He was in the court of Raja Krishnachandra, the famous king of Nadia in the 18th century AD. Such was the genius of Gopal that the King considered him as a Navaratna of his court. His statue can still be seen in the palace of Raja Krishnachandra. Stories about his exploits are narrated in Bengal to this day and are immortalized in countless short stories. The stories are short, beautiful, humorous and have a specific social message. Gopal Bhar is famous for stories of his wisdom, in which he outwits other fellow courtiers.Click to watch all the episodes of Gopal Bhar -https://www.youtube.com/playlist?list=PL5O3zv2ZcASj1d8U8PvhnbuO58CfvdkLUলোকক্ষ্মী এলো ঘোরে | Gopal Bhar | Episode - 1092"
"zmCWr8Bn_LQ","Sunn Mere Dil Episode 04 [Eng Sub] Digitally Presented by Lux - Happilac Paints and Blesso Cosmetics","2024-10-17T16:01:03Z","UCe9JSDmyqNgA_l2BzGHq1Ug","HAR PAL GEO","Entertainment","24.20.10","geo dramas|latest pakistani drama|pakistani drama|har pal geo|pakistani drama ost|पाकिस्तानी सीरियल|पाकिस्तानी ड्रामा|Wahaj Ali|Maya Ali|Usama Khan|Hira Mani|Amar Khan|Saba Hameed|Syed Mohammed Ahmed|Shahvir Kadwani|Sunn Mere Dil Ep 04|Sunn Mere Dil Ost|Sunn Mere Dil 04|wahaj ali new serial pakistani|Maya Ali new serial|sunn mere dil drama episode 4|sun mere dil|sun mere dil episode 4|Sunn Mere Dil|17th October 2024|ED-AA-UL-AA-CC-AA-TH-AA|#ep04","6053035","102621","0","3057","https://i.ytimg.com/vi/zmCWr8Bn_LQ/default.jpg","False","False","Thanks for watching Har Pal Geo. Please click here https://bit.ly/3rCBCYN to Subscribe and hit the bell icon to enjoy Top Pakistani Dramas and satisfy all your entertainment needs. Do you know Har Pal Geo is now available in the US? Share the News. Spread the word.Sunn Mere Dil Episode 04 [Eng Sub] Digitally Presented by Lux - Happilac Paints and Blesso Cosmetics - Wahaj Ali - Maya Ali - 17th October 2024 - Har Pal GeoSunn Mera Dil Digitally Presented by Lux - Happilac Paints and Blesso Cosmetics7th Sky Entertainment’s highly anticipated mega signature project, Sunn Mere Dil, is the most awaited drama serial. The mega drama boasts a star-studded cast led by Wahaj Ali and Maya Ali. Written by the renowned Khalil Ur Rehman Qamar and directed by the acclaimed Haseeb Hasan, Sunn Mere Dil promises to be a one-of-a-kind drama.Sunn Mere Dil is a tale in which love finds a new meaning, where one person’s devotion quietly flourishes, often unnoticed. Their heart beats for someone who may never truly understand the depth of their feelings. Yet, in their silent sacrifices, they realize that true love is not aboutpossession but about selflessness.Every unspoken gesture and unseen act of kindness brings them fulfillment, as they put their beloved’s happiness above their own, showing that love is not just about being together, it’s about redefining happiness, even at the expense of their contentment.7th Sky Entertainment PresentationProducers: Abdullah Kadwani & Asad QureshiDirector: Haseeb HasanWriter: Khalil Ur Rehman QamarCast:Wahaj Ali as Bilal Abdullah Maya Ali as SadafUsama Khan as AmmarHira Mani as HamshaAmar Khan as DaniaSaba Hameed as FarzanaSyed Mohammed Ahmed as NamdaarShahvir Kadwani as Zaviyaar#glowingmomentsbylux#HappilacPaints #colorsofhappiness #Blessocosmetics#SunnMeraDil#WahajAli#MayaAli"
"fRxxNAMsZcg","India's Most EXPENSIVE Street Food - Pani Puri","2024-10-13T14:09:13Z","UCtgGOdTlM-NdJ9rPKIYN8UQ","Slayy Point","Comedy","24.20.10","street food|abhyudaya|gautami|pani poori|pani puri|slayy point|food vloggers","4738268","238074","0","5713","https://i.ytimg.com/vi/fRxxNAMsZcg/default.jpg","False","False","Download the POPclub app now -https://8mvyk.app.link/7bELAmK8BNbExclusive offer: Use POP UPI and get cashback for the next 3 days!Also, get 2% POPcoins on every UPI spend with POPclub plus 50 bonus POPcoins on the first UPI transaction. 1 POPcoin = ₹1. Redeem your POPcoins across 500+ India’s top new-gen brands across Electronics, Fashion, Beauty & Personal Care, Food & Beverages & moreWe tried the weirdest and the most expensive paani poori in India.Pani puri / gol gappa / puchka / poochka / golgappeFollow us on Instagram -Gautami - https://www.instagram.com/gautamikawale/Abhyudaya - https://www.instagram.com/abhyudaya_mohan/Instagram - https://www.instagram.com/slayypoint/Facebook - https://www.facebook.com/SlayyPointTwitter - https://twitter.com/slayypointSubtitles by Nitika (available within 1-2 days of upload)E-mail for BUSINESS ENQUIRES ONLY- slayypointofficial@gmail.comPlease don’t visit the pages/videos of any of these people to spread negativity nor to spam comments on their work, we all are just having some light-hearted fun that stays & ends here, no hate intended, ever!Enjoy :)Watch our videos -When a Desi Goes to a Beach in USA | Miamihttps://www.youtube.com/watch?v=NOof2E0kMlM&pp=ygULc2xheXkgcG9pbnQ%3DThe Weirdest Sellers of Instagram Reelshttps://www.youtube.com/watch?v=QPlIpbvfZiA&t=632s&pp=ygULc2xheXkgcG9pbnQ%3DDumbest Scientists on YouTube!https://www.youtube.com/watch?v=vlSJXtBg0Uk&t=329s&pp=ygULc2xheXkgcG9pbnQ%3D"
"_RLHAy4jnd4","Veera(வீரா) | திங்கள்-வெள்ளி இரவு 8 மணிக்கு | 17 Oct 24 | Promo | Zee Tamil","2024-10-17T06:53:31Z","UC_wIGmvdyAQLtl-U2nHV9rg","Zee Tamil","Entertainment","24.20.10","Zee Tamil|zeetamil|ஜீ தமிழ்|zee தமிழ்|Tamil channel|tamil tv serial|tamil serial|zee tamil show|entertainment|daily soaps|family|drama|comedy|horror|thriller|romance|romantic|tamil|free|download|mobile|story|episode|latest|scene|full episode|best scene|webisode|precap|preview|promo|complete series|video|youtube|tv|popular shows|zee5|ZEEL","833955","14131","0","57","https://i.ytimg.com/vi/_RLHAy4jnd4/default.jpg","False","False","#Veera #Maaran #Kanmani #Ramachandran #Valli #Raghavan #Promo #ZeeTamilZee5 Paid Subscription Link: https://bit.ly/32gxIJ4Free Subscription click here: https://bit.ly/SubscribeFreeZeeTamilGet notified about our Latest update by Clicking the Bell Icon 🔔To Free Download ZEE5 Mobile app click the link belowPlaystore: http://bit.ly/Zee5PlayStoreiTunes: http://bit.ly/Zee5ITunesConnect with Zee Tamil on Social MediaWhatsapp: https://bit.ly/ZeeTamilWhatsAppFacebook: http://bit.ly/ZeeTamilFBInstagram: http://bit.ly/ZeeTamilInstaTwitter: http://bit.ly/ZeeTamilTwitterConnect with Zee5 on Social MediaFacebook: http://bit.ly/Zee5TamilFBInstagram: http://bit.ly/Zee5TamilInstaTwitter: http://bit.ly/Zee5TamilTwitter"
"WnuaECrFt4g","Lawrence Bishnoi: 33 ఏళ్లకే 700 మంది సభ్యుల గ్యాంగ్‌ను నడుపుతున్న లారెన్స్ బిష్ణోయీ ఎవరు?","2024-10-16T07:27:06Z","UCiTCB-B_weEmwHk7ifNobQw","BBC News Telugu","News & Politics","24.20.10","lawrence bishnoi|lawrence bishnoi gang|who is lawrence bishnoi|baba siddique lawrence bishnoi|gangster lawrence bishnoi|salman khan lawrence bishnoi|baba siddique lawrence bishnoi case|lawrence bishnoi baba siddique|sidhu moose wala lawrence bishnoi|BBC Telugu|BBC News Telugu|BBC Telugu News|BBC Telugu News Live|bbc news telugu live|bbc telugu updates|బీబీసీ తెలుగు|తెలుగు బీబీసీ|లారెన్స్ బిష్ణోయీ|బాబా సిద్ధిఖీ|పంజాబ్|సిద్ధు మూసేవాలా","365246","3482","0","412","https://i.ytimg.com/vi/WnuaECrFt4g/default.jpg","False","False","ఎన్సీపీ నేత బాబా సిద్ధిఖీ అక్టోబర్ 12 రాత్రి హత్యకు గురయ్యారు. సిద్ధిఖీ హత్యలో ముగ్గురు షూటర్ల ప్రమేయం ఉందని ముంబయి పోలీసులు ధ్రువీకరించారు. లారెన్స్‌ బిష్ణోయ్‌ గ్యాంగ్‌తో వారికి సంబంధముందని తెలిపారు. దీంతో ఎవరీ లారెన్స్ బిష్ణోయీ అన్న చర్చ మళ్లీ తెరపైకి వచ్చింది.#LawrenceBishnoi #BabaSiddique #Punjab ___________బీబీసీ న్యూస్‌ తెలుగు వాట్సాప్‌ చానల్‌: https://whatsapp.com/channel/0029VaapAsv1NCrTXxgk5M2N వెబ్‌సైట్‌:  https://www.bbc.com/telugu"
"l-R48TG-iAc","Yeh Rishta Kya Kehlata Hai Today Episode NEW PROMO | 18th October 2024 |","2024-10-18T00:42:31Z","UCVGiG3GcphUyMzNXg2iMN3A","Telly Reporter","Entertainment","24.20.10","yeh rishta kya kehlata hai|yeh rishta kya kehlata hai full episode today|yeh rishta kya kehlata hai new promo|yrkkh full episode today promo|Yeh Rishta Kya Kehlata hain Full Episode Promo 14th october2024|star plus yeh rishta kya kehlata hai|yeh rishta kya kehlata hai today episode|yeh rishta kya kehlata hai 18th october 2024|yeh rishta kya kehlata hai today full episode|yeh rishta kya kehlata hai aaj ka full episode|yrkkh telly reporter|yrkkh full episode today","1218377","13724","0","298","https://i.ytimg.com/vi/l-R48TG-iAc/default.jpg","False","False","Star Plus Serial YRKKH / Yeh Rishta Kya Kehlata Hai NEW PROMO Today Episode |18th October 2024  | #yehrishtakyakehlatahai #RohitPurohit #SamridhiShukla #yrkkh ➤Subscribe Telly Reporter @ http://bit.do/TellyReporter⦿SOCIAL MEDIA Links⦿➤https://www.facebook.com/TellyReporter➤https://x.com/TellyReporter➤https://www.instagram.com/TellyReporter⦿ Follow TellyReporter With #TellyReporter #TellyExclusive"
"vAva8PSmzHE","Khichdi | the mridul | Pragati | Nitin","2024-10-13T12:30:42Z","UC0zXnLIFedO97pFsyMxZcFg","The MriDul","Comedy","24.20.10","the mridul|i am nitin|mastani comedy|the mridul video|nitin mridul video|comedy video|funny video|nitin mridul ki video|mridul nitin ki video|nitin mridul ki comedy|mastani video|pragati video|pragati comedy|khichdi|khichdi video|nitin mridul ki khichdi|khichdi comedy","4035708","166044","0","8131","https://i.ytimg.com/vi/vAva8PSmzHE/default.jpg","False","False","Hello Doston👋🏻🥰Download DirectPay4U app -  https://www.directpay4u.com/r/TheMridul“ आप हँसते रहो, हम हँसाते रहेंगे “ Follow MriDul on instagram ~ https://www.instagram.com/themridul_/Follow Nitin on instagram ~ https://www.instagram.com/i.am.nitin_/ Khichdi | the mridul | Pragati | NitinSCRIPT ~  The MriDul DIRECTED BY ~ Nitin, MriDulSHOOT & EDIT ~ Maan Gujjar ASSISTANT DIRECTOR ~ Ujjwal MUSIC ~ Maan Gujjar THUMBNAIL ~ Raj SharmaCAST ( Male )                 CAST( Female)MriDul                             Pragati Nitin                                Preeti Ujjwal ( Mastani )           KhushiiiPapa ( Smack that )       Aarav, Prashant              Crowd                            #directpay4u #cashbackapp #mobilerecharge #commissionSpecial Thanks To You All Supporter PLEASE SUBSCRIBE ❤️"
"1_wVEmc84G0","Vettaiyan Deleted Scene 1 | Vettaiyan |Rajinikanth | Fahadh Faasil | Amitabh | TJ Gnanavel | Anirudh","2024-10-15T06:30:09Z","UCA7gwgLgmCZ8DSmdf2bhb8g","Lyca Productions","Film & Animation","24.20.10","Lyca Productions|Lyca|Thalaivar 170|Thalaivar 170 title reveal|Vettaiyan|T.J. Gnanavel|Rajinikanth|Anirudh|Vettaiyan title reveal|Thalaivar 170 title|Happy Birthday Rajinikanth|thalaivar 170 announcement|thalaivar 170 official announcement|vettaiyan announcement|vettaiyan first look|vettaiyan motion poster|vettaiyan songs|Rajinikanth dubbing|Rajinikanth Vettaiyan|vettaiyan review|vettaiyan song","575911","23046","0","493","https://i.ytimg.com/vi/1_wVEmc84G0/default.jpg","False","False","#Vettaiyan #Thalaivar170 #Rajinikanth #Subaskaran #LycaProductions #TJGnanavel #Anirudh #vettaiyanfromoct10Lyca Productions Subaskaran PresentsSuperstar Rajinikanth in VettaiyanVettaiyan Movie Credits:Cast: Rajinikanth, Amitabh Bachchan, Fahadh Faasil, Rana Daggubati, Manju Warrier, Kishore, Ritika Singh, Dushara Vijayan, Abhirami, GM Sundar, Rohini, Rao Ramesh, Ramesh Thilak, Rakshan  Writer & Director: T.J. GnanavelMusic: Anirudh RavichanderDirector of Photography: S.R. Kathir I.S.C Production Designer: K.KadhirAction Director: AnbarivEditor: Philomin RajCreative Director: B KiruthikaArt Director: Sakthee Venkat RajMakeup: Banu B - Pattanam RasheedCostume Design: Anu Vardhan - Veera Kapoor - Dinesh Manoharan - Liji Preman - SelvamStills: Murugan Publicity Design: Gopi PrasannaPublicity Photography: Anandha KrishnanVFX Supervision: Lavan - KusanTitle Animation: The Ident LabsSound Design: Sync Cinema Sound Mixing: Kannan GanpatColorist: Raghunath VarmaDI: B2H StudiosDIT: GB ColorsPRO: Riaz K AhmedExecutive Producer: Subramanian NarayananHead of Lyca Productions: G.K.M. Tamil KumaranProduced by SubaskaranLabel: Sony MusicFollow Lyca Productions onFacebook - https://www.facebook.com/LycaProductions Twitter - https://twitter.com/LycaProductionsInsta - https://instagram.com/Lyca_Productions"
"XkzAbZR3awQ","Kumkum Bhagya - कुमकुम भाग्य - Mon - Fri -  9:00 PM - Promo - Zee TV","2024-10-18T10:30:06Z","UCppHT7SZKKvar4Oc9J4oljQ","Zee TV","Entertainment","24.20.10","Kumkum Bhagya|कुमकुम भाग्य|kumkum bhagya serial|Kumkum Bhagya - Ek Nayi Shuruwaat|Prachi|Ranbeer|Krishna Kaul|Mugdha Chaphekar|Tina Phillips|Rajvansh|Abrar Qazi|Purvi|Rachi Sharma|Khushi|ज़ी टीवी|हिन्दी चैनल|Hindi GEC TV channel|hindi tv serial|zeetv|hindi serial|show|entertainment|daily soap|family|family story|indian tv serials|general entertainment channel|zee popular show","691247","9209","0","154","https://i.ytimg.com/vi/XkzAbZR3awQ/default.jpg","False","False","Watch Kumkum Bhagya Full Episodes: https://bit.ly/3ThafS5. Free Subscription click here: https://bit.ly/SubscribetoZeetv Get notified about our Latest update by Clicking the Bell Icon 🔔Kumkum Bhagya : Poorvi and her sister Khushi are stark opposites, but they share a strong bond. However, Poorvi’s marriage with Rajvansh brings about an unexpected turn of events in the sisters’ lives.Kumkum Bhagya Quick Recaps Playlist:https://www.youtube.com/playlist?list=PLVqBLRhC9UzGJNgY-XmdkZsNCnv2ooUd8Kumkum Bhagya Webisodes Playlist:https://www.youtube.com/playlist?list=PLVqBLRhC9UzG5NdVJTO5OEGZxbGUEq4xdKumkum Bhagya Best Scenes Playlist:https://www.youtube.com/playlist?list=PLVqBLRhC9UzHfUvTByOnz4X1eWqwkEwZEPaid Subscription ZEE5 click here: http://www.zee5.com/myaccount/subscription?plid=0-11-1503&utm_source=yt_zeetv&utm_medium=link_desc&utm_campaign=subscription_lpWatch tomorrow’s Premiere Episodes of ZEE TV serials today. Get the best of ZEE5 Originals, popular Alt Balaji shows, 1000+ superhit movies, favourite Zindagi shows, popular kids entertainment, Live TV channels and more.To Download Free ZEE5 Mobile app click the link below -Playstore: http://bit.ly/Zee5PlayStoreiTunes: http://bit.ly/Zee5ITunesConnect with Zee TV on Social MediaFacebook: http://bit.ly/ZeeTvFBInstagram: http://bit.ly/ZeeTvInstaTwitter: http://bit.ly/ZeeTVtwitterConnect with ZEE5 on Social MediaFacebook: http://bit.ly/Zee5FBInstagram: http://bit.ly/Zee5HindiInstaTwitter: http://bit.ly/Zee5twitter"
"ckZoQaZu9Z4","Ghum Hai Kisikey Pyaar Meiin: Rajat Realises His Mistake And Apologies To Savi |SBB","2024-10-17T09:31:35Z","UCPmpyXciSmUXPwdTW_0mbGw","Saas Bahu Aur Betiyaan","Entertainment","24.20.10","saas bahu beti|saas bahu aur beti|saas bahu aur betiyaan|celeb interviews|SBB|Aaj Tak","632973","5669","0","209","https://i.ytimg.com/vi/ckZoQaZu9Z4/default.jpg","False","False","Ghum Hai Kisikey Pyaar Meiin: Rajat Realises His Mistake And Apologies To Savi |SBB#saasbahuaurbetiyaan  #atsbb #sbb #GhumHaiKisikeyPyaarMeiin #bhavikasharma #hiteshbharadwaj ----------------------------------------------------------------------------------------------------------------------------------------If you like the video please press the thumbs-up button. Also, leave us your valuable feedback in the comments below. For the latest updates on Television News visit us at:  https://bit.ly/3X6E9Y5Free Subscribe: https://bit.ly/3X6E9Y5Follow Us On Instagram - https://www.instagram.com/atsbb/Follow Us on Twitter - https://twitter.com/ATSBB Like Us on Facebook - https://www.facebook.com/ATSBBOfficialThanks For Watching."
"2oR6xDv_xYo","Teri Chhaon Mein - Ep 21 [CC] - 17 Oct 2024 - Jhalak Beauty Cream [ Danish Taimoor & Laiba khurram ]","2024-10-17T16:00:04Z","UCEeEQxm6qc_qaTE7qTV5aLQ","HUM TV","Entertainment","24.20.10","pakistani serial|best pakistani drama|Teri Chhaon Mein ep 21|Teri Chhaon Mein new ep|Teri Chhaon Mein 21 ep|Teri Chhaon Mein episode 21|Danish Taimoor new drama|Danish Taimoor|new pakistani drama|teri chhaon men ep 21|drama pakistani|pakistani drama|tum mery kia ho latest episode|pakistani comedy scene|best short pakistani drama 21|teri chhaon|teri chaon mein drama|teri chhaon mein episode 21|teri chhaon mein","5251861","108271","0","1940","https://i.ytimg.com/vi/2oR6xDv_xYo/default.jpg","False","False","👉 Subscribe To HUM TV - https://bit.ly/HumtvpkTeri Chhaon Mein - Episode 21 [CC] - 17 October 2024 - Digitally Assoicated By Jhalak Beauty Cream- [ Danish Taimoor & Laiba khurram ] - HUM TVBlind trust in love can take you to the road of irreversible destruction!!Watch The Drama Serial Teri Chhaon Mein Every Thursday at 8:00 PM Only On HUM TV.Digitally Assoicated By Jhalak Beauty CreamWriter:Radain ShahDirector:Abdullah Badeni Producer:Momina Duraid ProductionsCast:Danish Taimoor, Laiba Khurram, Sohail Sameer, Tehseen Wajahat, Behroz Sabzwari, Hassan Niazi, Angeline Malik, Noor Ul Ain Zaidi, Raza Abid, Rao Muhammad Shahwaiz, Aslam Sheikh, Shabbir Jan, Tarah Mahmood, Fareeda Shabbir, Nancy, Hurriya Mansoor#terichhaonmeinep21#humtv #drama #danishtaimoor #laibakhurram"
"MYQy3_uypOg","Etne Saare Gifts Le Liya 😍 Birthday Preparations","2024-10-17T02:30:17Z","UCjvgGbPPn-FgYeguc5nxG4A","Sourav Joshi Vlogs","People & Blogs","24.20.10","[none]","4100626","234457","0","7339","https://i.ytimg.com/vi/MYQy3_uypOg/default.jpg","False","False","Folllow  me on Instagram- https://www.instagram.com/souravjoshivlogs/?hl=en I hope you enjoyed this videohit likes.And do subscribe to my channelThank you so much for watchinggod bless you all.lots of  ❤️( For Collaboration - officialsouravjoshivlogs@gmail.com"
