video_id,title,publishedAt,channelId,channelTitle,category,trending_date,tags,view_count,likes,dislikes,comment_count,thumbnail_link,comments_disabled,ratings_disabled,description
"xqUVRD83LQ4","HOW TO JOIN DIWALI SQUAD CUP TAMIL | HOW TO REGISTER DIWALI SQUAD CUP FREEFIRE DIWALI SQUAD CUP","2024-10-19T00:57:34Z","UCBOj97LKJjpwOE2Oqh-jNlQ","SMART MACHI GAMING","Gaming","24.20.10","Diwali squad Cup event tamil|freefire Diwali squad Cup|how to join Diwali squad Cup|how to register Diwali squad Cup|new Diwali squad Cup event tamil|freefire Diwali squad Cup tournament|freefire tournament|freefire new event|new event freefire|freefire tamil|freefire Diwali squad Cup event","34288","2926","0","97","https://i.ytimg.com/vi/xqUVRD83LQ4/default.jpg","False","False","#diwalisquadcup #howtojoindiwalisquadcup #diwalisquadcuptamil #howtoregisterdiwalisquadcup #freefireevent #freefiretournament #freefirediwalisquadcuptamil #freefireneweventdiwali squad cupfree fire diwali squad cupfree fire new eventdiwali squad cup free firediwali event free firediwali squad cup eventhow to play diwali squad cup free firediwali squad cup 2024ff diwali squad cupdiwali squad cup registrationdiwali squad cup event free firehow to registration diwali squad cup free firediwali squad cup registration free firediwali squad cup tournamenthow to join diwali squad cup eventfree fire new event todaydiwali squad cup register processfree fire diwali squad cup registrationfree fire new diwali eventdiwali squad cup me registration kaise karefree fire diwali squad cup me registeration kaise karefree fire diwali squad cup how to registerfree fire maxnew diwali squad cup eventdiwali squad cup me registeration kaise karediwali eventhow to register diwali squad cuphow to register in diwali squad cupfree fire tournamentdiwali squad cup redeem codefree fire diwali event 2024diwali squad cup mein registration kaise karendiwali squad cup event complete kaise karegarena free firetournament kab hoga ffdiwali squad cup datediwali squad cup full detailupcoming event in free firefree fire upcoming eventnext lucky wheel eventdiwali magic cube store updatediwali squad cup free diamondfreefire indiafree diamondhow to complete new diwali cup eventnew diwali event free firediwali cup event reward kaise milegahow to get diwali squad cup all rewradsdiwali squad cup event kaise pura karediwali squad cup✨how to win diwali squad cup|| diwali specialfree fire diwali squad cup resultfree fire diwali squad cup registerfree fire diwali squad cup me register kaise karefree fire diwali squad cup full detailsdiwali cup free firediwali free rewardsff max new eventhow to join diwali squad cup tournamenthow to register in diwali squad cup 2024diwali tournament join kese kreff india mew tournamenthow to participate in diwali squad cupdiwali squad cup rewardsnew diwali squad cup kaise karennew event kaisa complete karehow to complete diwali event 2024new diwali squad cup"
"1oj_yMsjVEk","Moondru Mudichu - Promo | 19 Oct 2024 | Tamil Serial | Sun TV","2024-10-18T16:56:10Z","UCBnxEdpoZwstJqC1yZpOjRA","Sun TV","Entertainment","24.20.10","Moondru Mudichu|Moondru Mudichu serial|Moondru Mudichu serial promo|Moondru Mudichu today|Moondru Mudichu promo today|serial|sun tv serial|Moondru Mudichu serial sun|Moondru Mudichu sun tv serial|Moondru Mudichu tamil serial today|Moondru Mudichu todays episode|Moondru Mudichu episode|Moondru Mudichu sun tv serial today|tamil serial","746854","9603","0","82","https://i.ytimg.com/vi/1oj_yMsjVEk/default.jpg","False","False","Watch the Latest Promo of popular Tamil Serial #MoondruMudichu that airs on Sun TV.Watch all Sun TV serials immediately after the TV telecast on Sun NXT app. *Free for Indian Users onlyDownload here:Android - http://bit.ly/SunNxtAdroidiOS: India - http://bit.ly/sunNXTWatch on the web - https://www.sunnxt.com/Nandini is a self-assured girl who puts her family’s happiness above hers. On the other hand Surya hates his mother due to lingering resentments and deliberately bonds with Nandini to cause strife. Watch what destiny has in store for Nandini & Surya.#MoondruMudichuPromo #MoondruMudichuSerial #MoondruMudichu #SunTVSerial #SunTVDon't forget to SUBSCRIBE to the Sun TV YouTube 👉 http://bit.ly/suntvsubscribe---------------------------------------------------------Watch more:Movie Clips on SUN NXT - https://bit.ly/3gc1dPIShows from Sun Music - http://bit.ly/2YS5eBiComedy Shows from AdithyaTV - http://bit.ly/2K6VaiZNews from Sun News - http://bit.ly/2Yyvgsi---------------------------------------------------------SUN NXT: Watch the latest movies in DOLBY DIGITAL PLUS, 4000+ Movies in HD, 30+ Live TV Channels, TV Shows, TV Serials & Digital Exclusives on SUN NXT anywhere anytime.---------------------------------------------------------Follow us on Social Media for Latest Updates:Facebook: https://www.facebook.com/SunTVTwitter: https://twitter.com/SunTVInstagram: https://www.instagram.com/suntv---------------------------------------------------------#SuntvSerial #TamilSerialPromo #SunTVshows #NewTamilSerials #SunTV #SunTVserials #SunTVProgram #SunNXT #LatestTamilSerials #SuntvSerialPromo #SuntvSerialEpisodes #SunTVpromos #TamilSerialPromos #TamilTVserials #TamilSerialEpisodes---------------------------------------------------------"
"W9EYDpM7coo","SECOND CHANCE | EP -3 | WEB SERIES | AMEER SHA | DEVIKA | SHAMEDIA","2024-10-18T12:30:34Z","UCSSU17J3BF6RjuoOzyJBtWw","Sha media","Entertainment","24.20.10","Arm|armsong|Trending|Ameersha|Shortfilm|Web series|Devika|Newshortfilm|Episode3|Ameersha new shortfilm","83295","7186","0","169","https://i.ytimg.com/vi/W9EYDpM7coo/default.jpg","False","False","Download the MPL app from this link https://mpl.onelink.me/paSU/ShameMedia and play 60+ games and win real cash rewards by playing simple games daily.Cast - Ameer sha , Devika, Hariraj , Shruthi , Amal , Shamlin ,nandana enquiries & feedbacks - shamedia555@gmail.com DIRECTED BY - AMEER SHA PRODUCED BY - HARIRAJ NAIRWRITTEN BY - AMEER SHA SINGER - RIGHTEOUS NEW DOP - RIGHTEOUS NEW  , SANGEETH VAMADHEVAN EDIT & DI - RIGHTEOUS NEW BGM & SFX - RIGHTEOUS NEWTITLE - ANOOP KRISHNAN DUB - D&S WORKSTATION KOCHI  DISIGNER - ANOOP KRISHNAN"
"yDbg3SGQ2DQ","INDIA'S GOT LATENT | EP 08 ft. @poonampandeyonline @viditchess @vivekmagic ​⁠","2024-10-13T16:30:07Z","UCAov2BBv1ZJav0c_yHEciAw","Samay Raina","Entertainment","24.20.10","samay raina|samay raina comedy|samay raina chess|standup comedy|comedy|trending|samay funny|samay|comicstaan|streaming chess|chess|chess funny","12987591","639266","0","17725","https://i.ytimg.com/vi/yDbg3SGQ2DQ/default.jpg","False","False","Become a member herehttps://www.youtube.com/channel/UCAov2BBv1ZJav0c_yHEciAw/joinLatent' is an ability that is hidden deep inside.If you have a 'Latent' or want to discover your latent by participating in future episodes please follow Samay Raina's instagram channel and look for the story updates for the participation link.Instagram:   instagram.com/maisamayhoon  IGL official handles -https://www.youtube.com/@IndiasGotLatentOfficial/https://www.instagram.com/indiasgotlatent/Shot & Recorded by The Habitat StudiosEdited by: Pratham Sagar my GPost Production Studio:Audio Mix and Master - Yash Rajiv Barse (The Habitat Studios)Line Producer: Tushar Poojari Assisted by: Dhristi PalreshaLive Producer: Saurabh BothraThe Habitat Audio Team: Yash Rajiv Barse Assisted by Abhay Thakur The Habitat Video Team:Vivian CastelinoAaditi HiraniHarsh ShahInspired by: Kill TonyLocation: The Habitat, Mumbai"
"c88AaM_A2SM","#Eka_Karelu| ईका करेलु #Khesari Lal Yadav, #Shilpi Raj |  | New Bhojpuri Song 2024","2024-10-17T11:30:20Z","UCJfeUWkrU4JwIJfP-usd-_w","Khesari Music World","Music","24.20.10","Bhojpuri Hit Song|Khesari Lal Yadav|BhojpuriHitSong2021|khesari lal yadav|khesari lal yadav ka new bolbam song|khesari lal new song|khesari lal yadav aur antra singh ka bhojpuri bolbam video song|khesari lal yadav hits","1832969","136012","0","23623","https://i.ytimg.com/vi/c88AaM_A2SM/default.jpg","False","False","Subscribe Now:-  https://goo.gl/j2d2ThIf you like Bhojpuri song, Bhojpuri full film and bhojpuri movie songs, Subscribe Now:- https://goo.gl/j2d2ThVisit our website to download our songs and videos: http://www.khesarientertainment.inLike Us On Facebook - https://www.facebook.com/khesarimusicworld/Album :-  ईका करेलु Song :- eka kareluSinger :- Khesari Lal yadav & Shilpi rajLyrics :-  Vishal BhartiMusic :- Arya SharmaDigital Managed By :- Global Music Junction Pvt. Ltd.Company/Label - Khesari Music World"
"_oM_x7IraCA","Maharashtra Assembly Election 2024 : लाडक्या बहीणींची मतं युतीकडे वळणार का?| Eknath Shinde | BJP","2024-10-17T12:30:06Z","UCQ2W9GCHctD59vQpvLKVg3g","Mumbai Tak","News & Politics","24.20.10","maharashtra election 2024|maharashtra election date 2024|maharashtra opinion poll 2024|maharashtra assembly election 2024|eknath shinde|uddhav thackeray|uddhav thackeray news today|maharashtra election survey 2024|maharashtra assembly election 2024 opinion poll|ladki bahin yojana|ladki bahin yojana new update|shiv sena candidate list|devendra fadnavis|shiv sena|bjp candidate list|mumbai tak live|anuja dhakras|bjp|sharad pawar speech|mva seat sharing|ncp","475751","2401","0","859","https://i.ytimg.com/vi/_oM_x7IraCA/default.jpg","False","False","#MarathiNews  #LatestMarathiNews #MaharashtraPolitics#MaharashtraAssemblyElection #LadkiBahinYojana #EknathShinde आवाज कुणाचा? : देशातील नागरिकांसाठी भारत सरकारने अनेक योजना सुरु केल्या आहेत. या योजनेच्या माध्यमातून वेगवेगळ्या लोकांना लाभ मिळतो. केंद्र सरकारच्या माध्यमातून देशातील कोट्यावधी लोकांसाठी योजना सुरु केल्या जातात. तसच राज्य सरकारेही जनतेसाठी विविध योजना सुरु करतात. विशेषत: गरिब लोकांसाठी या योजना सुरु केल्या जातात. सरकारकडून महिलांसाठीही अनेक प्रकारच्या योजना सुरु केल्या जातात. राज्य सरकारने महिलांसाठी मुख्यमंत्री माझी लाडकी बहीण योजना सुरु केली आहे. या योजनेच्या माध्यमातून सरकार पात्र महिलांना दरमहा 1500 रुपये देत आहे. लाडक्या बहीणींच्या खात्यात पैसे, पण मतं मिळणार का? पाहा महिला मतदारांची एक-एक भन्नाट उत्तरं 🔴लॉग इन करा: https://www.mumbaitak.in/Follow us on :Google News : https://news.google.com/publications/CAAqBwgKMLeLpAsw-pW8Aw?hl=mr&gl=IN&ceid=IN%3AmrFacebook: https://www.facebook.com/mumbaitakInstagram: https://www.instagram.com/mumbaitakTwitter: https://twitter.com/mumbai_takhttps://www.youtube.com/playlist?list=PLzHYo6L3SZJGBWc_BPfqMt5Yq24d_AXCa#maharashtra #marathi ##marathinewsइंडिया टुडेच्या मुंबई तक या मराठी युट्यूब चॅनलवर आपलं स्वागत. इंडिया टुडे ग्रुपचे मॅगझिन, इंडिया टुडे टीव्ही आणि आज तक हे लोकप्रिय न्यूज चॅनल आपल्याला माहितीच आहे. त्यानंतर आता खास मराठी प्रेक्षकांसाठी आपण भारतीय प्रादेशिक भाषेतलं पहिलं मराठी चॅनल घेऊन आलोय. महाराष्ट्रासह राष्ट्रीय आणि आंतरराष्ट्रीयस्तरावरील महत्वाच्या बातम्या आणि घडामोडी आपल्याला अगदी सोप्या शब्दांत समजावण्याचा आमचा प्रयत्न असणार आहे. Namskar, Welcome to India Today group’s new Marathi YouTube channel – Mumbai Tak. Get all the latest important stories and updates from in and around Maharashtra in Marathi. Stay Tuned to Mumbai Tak for current affairs, politics, sports, business, entertainment, literature and many more in Marathi."
"7wi6wvkvx6E","Full Video: Spark | The GOAT | Thalapathy Vijay | Venkat Prabhu | Yuvan Shankar Raja","2024-10-16T05:29:07Z","UCAEv0ANkT221wXsTnxFnBsQ","T-Series Tamil","Music","24.20.10","tseries|tseries songs|spark Full video|spark song full video|spark song full Video|spark full video vijay thalapathy|spark vijay thalapathy|vijay thalapathy spark song|vijay thalapthy spark|vijay thalapathy spark Video|vijay thalapathy spark full Video song|spark song video tamil|spark Full Video song tamil|spark tamil song|vijay thalapathy song|vijay thalapthy spark song|vijay thalapathy hero songs|vijay thalapathy movie|greatest of all time|goat song|spark","2535598","95461","0","2329","https://i.ytimg.com/vi/7wi6wvkvx6E/default.jpg","False","False","The Greatest of All Time! Our Thalapathy Is Here. Presenting the Full Video Song Spark from the New Tamil Movie The Greatest Of All Time. Starring Thalapathy Vijay, Prashanth, Prabhudeva, Mohan, Jayaram, Sneha, Laila, Ajmal Amir, Meenakshi Chaudhary, Vaibhav, Yogi Babu, Premgi Amaren, Yugendran Vasudevan.#Spark #ThalapthyVijay #TheGoat #GreatestOfAllTime---------------------------------Connect with T-Series Tamil: 👉 http://bit.ly/SubscribeToTseriesTamil---------------------------------🎶 Music Slate 🎶Song Title : SparkAlbum/Movie : The Greatest of All TimeComposed by : Yuvan Shankar RajaLyricist : Gangai AmarenVocals : Yuvan Shankar Raja, Vrusha BaluWritten & Directed by Venkat PrabhuMusic : Yuvan Shankar RajaBanner : AGS Entertainment (P) LtdProducers : Kalpathi S Aghoram, Kalpathi S Ganesh, Kalpathi S SureshCreative Producer : Archana KalpathiAssociate Creative Producer : Aishwarya KalpathiExecutive Producer : S.M.Venkat ManickamDirector of Photography : Siddhartha NuniProduction Designer : RajeevanAction : Dilip SubbarayanEditor : Venkat RaajenDialogue Writers : Viji & Venkat PrabhuAdditional Screenplay & Dialogue : K.Chandru & Ezhilarasu GunasekaranArt Directors : B.Sekar & Surya RajeevanLyricists : Gangai Amaren, Madhan Karky, Kabilan Vairamuthu, VivekChoreography : Raju SundarmCostume designers : Vasuki Baskar & Pallavi SinghSound Mix : T UdayakumarSound Design : T Udayakumar , Renjith Venugopal, Saravakumar (Sound Vibe)Stills : D.ManekshaPromo Stills : SudharsanPublicity Designer : Gopi PrasannaProduction Executive : M.Senthikumar, Govindraj & RamkumarBalasubramanian VFX Head : R.Harihara SuthanDI : B2H StudiosCharacter Designer : Preetisheel Singh D’SouzaDirection Team : Kanthan Pitchumani, Saravana Rajan, Veer Ramakrishnan,Sasikumar Paramasivan, Thirunavukarasu, Senthil Velayudham, H.V.Priyan,L.J.Lokie, Prakruthee, Sushmitha Gajendran, Nirmal Chinnayan, Vasanthveeraputhiran ( vv ), Kiruba RobertCinematography Team : Abhishek Goud, Naveen Sasi, Sreerangam Sravan, PradeepThangavel,Vignesh Madheshwaran, Vivekanandan T.V, Pramod Ganta,Vikas Ravi,YuvanGimbal Operator - Vivek LREditing Team : Ajith R, Jayasurya D , Vignesh, SathishArt Direction Team : Devaraj, Prakash Ravichandran, Mohanraj, Premkumar BMaking & BTS: Team 'The Tabs'Production Managers : S.Mariappan, P.Viswanathan, Sakthi, K.R.RanganathanProduction Team : Kamal Radhakrishnan,Arthi Palanisamy, Suraj J S (Paul)AGS Marketing Team :  Sivakumar PK, Poorni Gopinath, Chinna Suresh, S Manoj Radhika Anandan, Vengatalakshmi Sama, V Shri ShivaniPRO : Nikil Murukan & Riaz K AhmedLyric Video by VenkyMusicians Credit :Song Composed, Arranged and Produced by: YuvanShankarRajaLyrics : Gangai AmarenSingers : YuvanShankarRaja ,Vrusha BaluAdditional Percussions: Karthik VamsiFlute : Lalit TalluriHarmonies: Balaji Sri, Vikram Pitty, Aravind Annest, Srivardhini Kuchi,Vanathishree Suresh,HemambigaVoice Supervision: Sam P KeerthanSong Produced and Recorded @ U1 Records and Studio Al Watan , DubaiRecording Engineers :Kausikan Sivalingam,Sharan RavinMixing Engineer: Kausikan SivalingamMix Assistant: Abinayan UdayakumarMixed at Studio Al Watan, DubaiMastering Engineer: Dave KutchMastered at The Mastering Palace, NYC, USA Music Label: T-Series------------------------------Enjoy & stay connected with us!!👉Subscribe to T-Series Tamil: http://bit.ly/SubscribeToTseriesTamil👉Like us on Facebook: https://www.facebook.com/TseriesTamil👉Follow us on Instagram: http://bit.ly/InstagramT-SeriesSouthOffical👉Follow us on Twitter: http://bit.ly/TwitterT-SeriesSouthOffical👉Follow us on Whatsapp: https://whatsapp.com/channel/0029VaYvKJUGehEWUOwOio0qThanks Everyone for Watching Our Latest Tamil Song 2024. If you like the song than Please SUBSCRIBE Our Channel With Bell Icon to get notification of all of our newest releases. Will Make Sure to provide best Tamil songs of all time."
"khwLgZBXyXs","Kunali K Liye Etne Saare Coins Aagye 😍","2024-10-19T02:30:28Z","UCjvgGbPPn-FgYeguc5nxG4A","Sourav Joshi Vlogs","People & Blogs","24.20.10","sourav joshi|sourav joshi vlogs|family vlogs|daily vlogs|piyush joshi|piyush joshi vlogs|sourav joshi arts|vlogs|family vlog|KUNALI|KUNALI JOSHI|KUNALI JOSHI VLOGS|kunali|kunali vlogs|kunali vlog|kunali k toys|kunali ka dant tut gya|ipl|ipl match|ipl match vlog|new gaming pc|new gaming pc vlog|gaming pc|kunali ka gaming pc|gaming pc for kunali|Secret Room|WE BUILD A HIDDEN SECRET ROOM IN OUR HOUSE|SECRET ROOM IN OUR HOUSE","3493548","184364","0","6260","https://i.ytimg.com/vi/khwLgZBXyXs/default.jpg","False","False","Folllow  me on Instagram- https://www.instagram.com/souravjoshivlogs/?hl=en I hope you enjoyed this videohit likes.And do subscribe to my channelThank you so much for watchinggod bless you all.lots of  ❤️( For Collaboration - officialsouravjoshivlogs@gmail.com"
"hDyCQIKX-uc","Ilakkiya Serial | EP 626 Highlights | 19th Oct 2024 | Shambhavy | Nandan | Sushma Nair","2024-10-19T09:30:13Z","UCtrovMbRR6h_XLMfdbhqb1A","Saregama TV Shows Tamil","Entertainment","24.20.10","ilakkiya serial promo|ilakkiya|Nandhan|Sushma|saregama tv shows tamil ilakkiya|ilakkiya serial today episode|Tamil Serial Highlights|Ilakkiya Sun tv|Ilakkiya Serial Shorts|Sun tv Ilakkiya Serial|Ilakkiya|Ilakkiya Serial Sun tv|Saregama Tv Shows Tamil|Ilakkiya Serial Highlights|Ilakkiya Latest Episode|Shambhavy|Shambhavy Gurumoorthy|ILAKKIYA 626|Ilakkiya Ep 626 Highlights|Ilakkiya Sun Tv Serial|Ilakkiya 626 Ep Sun tv|Saregama TV Shows Tamil|Ilakkiya 626","562742","8412","0","91","https://i.ytimg.com/vi/hDyCQIKX-uc/default.jpg","False","False","👉Subscribe To Saregama TV Shows Tamil -  https://bit.ly/SaregamaTVShowsTamilWatch today's Highlights from Ilakkiya Serial:               SUBSCRIBE to Saregama TV Shows Tamil Channel and Don't forget to switch ON your notification for all the upcoming serial episode updates.Credits:Ilakkiya:Cast: Shambhavy, Nandan, Sushma,Gayathri, Priya Prince, Sathish, Barath Kalyan & Others.Crew:Executive Vice President: B.R.VijayalakshmiCreative Head: PrinceStory: SaregamaScreenplay Design: Rajashri RoyScreenplay: SheklarDialogue: M. PALANISAMYDirector: NatarajanCameraman: VisuEditor: VinothProduction Controller: Kumar CCreative: ShanmugamWardrobe Courtesy: Yasko shirts (Madurai)   Follow us on Instagram : https://instagram.com/saregamatvshows_?igshid=MzRlODBiNWFlZA==Saregama India Limited, A RPSG Group CompanySubscribe to: http://www.youtube.com/saregamatvshowstamilFollow us on X: https://twitter.com/saregamasouthLike us on: https://www.facebook.com/saregamatamilVisit our website: http://www.saregama.com#ilakkiya  #IlakkiyaSerial  #SaregamaTVShowsTamil  #IlakkiyaSerialHighlights #shambhavygurumoorthy #nandanloganathan"
"HJymd6MhZDI","Bangladesh 'A' vs Hong Kong, China | Men's T20 Emerging Teams Asia Cup | Match 1","2024-10-18T14:17:01Z","UC7ITT3ooYWDYY_ehIUbt6eg","Asian Cricket Council","Sports","24.20.10","[none]","1128696","23946","0","855","https://i.ytimg.com/vi/HJymd6MhZDI/default.jpg","False","False","Men's T20 Emerging Teams Asia Cup | Match 1 | Bangladesh 'A' vs Hong Kong, China"
"L6DqLW0rv-o","Bloody Beggar - Official Trailer | Kavin | Nelson Dilipkumar | Sivabalan Muthukumar | Jen Martin","2024-10-18T13:30:19Z","UCBnxEdpoZwstJqC1yZpOjRA","Sun TV","Entertainment","24.20.10","bloody begger trailer|bloody begger official trailer|bloody begger teaser|bloody begger movie|bloody begger tamil movie|bloody begger kavin|kavin new movie|actor kavin|bloody begger teaser trailer|bloody begger movie trailer|director nelson|Nelson Movie|sivabalan muthukumar movie|Nelson dhilipkumar movie|diwali 2024 movie|diwali movie 2024|2024 diwali release|reding kingsly comedy|jen martin musical|jen martin|editor nirmal","3053241","141321","0","2110","https://i.ytimg.com/vi/L6DqLW0rv-o/default.jpg","False","False","Presenting the official trailer of the Movie Bloody Beggar, Starring Kavin, Redin Kingsley, and others. Produced by Nelson Dilipkumar, Written and directed by Sivabalan Muthukumar, and the Music Composed by Jen Martin.#BloodyBeggarTrailer #Kavin #NelsonDilipkumar #SivabalanMuthukumar #JenMartin #BloodyBeggarTeaser #BloodyBeggarMovie #BloodyBeggarOffiicalTrailer #kavin #actorkavin #directornelson #thinkmusicindia #thinkmusic #suntv #suntvnetwork *Bloody Beggar: A lazy beggar finds himself in trouble when a misadventure turns his life upside down. Will he be able to navigate through the ridiculous, strange, and witty mix-ups?*MOVIE CREDITS::Produced by NelsonWritten & Directed by Sivabalan MuthukumarBanner - Filament PicturesStarcast - Kavin, Redin Kingsley, Maruthi Prakashraj, Sunil Sukhada, T M Karthik, Padam Venu Kumar, Arshad, Miss Saleema, Priyadarshini Rajkumar,  Akshaya Hariharan, Anarkali Nazar, Dhivyaa Vikram, Tanuja Madhurapantula, Merin Philip, Rohit Denis, Vidyuth Ravi, Mohammed Bilal, U.Sree SarvavanDOP - Sujith SarangMusic Director - Jen MartinEditor - R.NirmalArt Director - Manimozhian Ramadurai @ AppuStunts - Action Santhosh, Metro MaheshCostume Designer - Jai ShakthiSound Designers - Suren.G, S.AlagiakoothanVFX Supervisor – AjayCharacter Designer (Kavin Beggar Character)-Vishwanath SundaramColourist - Shanmuga Pandian MDI Studio-Varna Digital StudioSpecial Makeup (Kavin Beggar Look)- Serina Tixeria (Mumbai)Makeup - Harinath.CCostumer Chief – Muthul HafeezStills - Sai SanthoshPublicity Designer – ViyakiLyricists- Vivek, Vishnu Edavan, Ashique AR, Venu SelvanMotion Poster – VenkyPRO - Suresh ChandraCreative Promotions – Beat RouteProduction Consultant - Srivijay RajasekarExecutive Producer - Raja SridharDirection Team - Naveen. M, Shanmugam Gayathri, Vidyuth Ravi, Arunkumar Nagarajan, Shyam ManiChief Associate Cinematographers - Mugilan.K, EJ VenuAssociate Cinematographer - Nithya.V,Assistant Cinematographers- Thamizhvanan.G, Ajay Kanna.DCo- Editor - Anjesh SAssociate Editor - Linganraj SVoice Sync- V. MurugeshArt Assistants - P. Gopu, Amarnath HP, Manimaran Moorthy, Sham Immanuel, Samynathan, BalakrishnanAssociate Costume Designer – Swathi RamakrishnanSpot Editor - Aathieswaran.RExecutive Manager – G.R. KathiravanAudio Label: Think Music"
"bbEnUUqYRQY","இதுக்கு அப்றம் நிம்மதி போச்சு🤕🤧 | Bali Ep- 8 | Vj Siddhu Vlogs","2024-10-18T09:30:07Z","UCJcCB-QYPIBcbKcBQOTwhiA","Vj Siddhu Vlogs","People & Blogs","24.20.10","Vj Siddhu Vlogs|Vj Siddhu Vlogs Youtube channel|Vj Siddhu Vlogs channel|Siddhu|Siddhu vlogs|Siddhu channel|Vj Siddhu channel|Vj Siddhu|Siddhu latest videos|Vj Siddhu Vlogs latest|Vlogs|fun panrom vlogs|siddhu vlogs|bali vlogs|bali series|vj siddhu vlogs|vj siddhu vlogs bali series|vj siddhu vlogs bali vlog|siddhu balli series|harshath khan|sathish|bali vlog|siddhu bali series|siddhu new series vlog|vj siddhu bali video|bali episode 8|Bali Vlogs","1663970","136354","0","1139","https://i.ytimg.com/vi/bbEnUUqYRQY/default.jpg","False","False","GT Holidays:Contact GT holidays for Tour Packages all across the globeFor more details : https://www.gtholidays.in/Call : 9940882200For Business inquiries please contact us :7200571056Gmail : vjsidduvlogsadv@gmail.com  #vjsiddhuvlogs #funvlogs #balivlogs #harshathkhan #episode8___________________________________Follow My Social Media Pages Facebook :- https://www.facebook.com/siddhuvideos?mibextid=LQQJ4dInstagram :- https://www.instagram.com/vjsiddhu_official/?igshid=OGQ5ZDc2ODk2ZA%3D%3DPage Instagram :- https://www.instagram.com/vjsiddhu_vlogs/?igshid=MmIzYWVlNDQ5Yg%3D%3D___________________________________In Association with DIVO - Digital PartnerWebsite - http://web.divo.in/Instagram - https://www.instagram.com/divomovies/Facebook - http://www.facebook.com/divomoviesTwitter - https://twitter.com/divomovies"
